text,target,word_count,stop_word_count,url_count,mean_word_length,char_count,punctuation_count
beyond all bounds  till inundation rise,0,6,1,0,5.666666666666667,39,1
three episodes left the end is nigh,0,7,2,0,4.142857142857143,35,0
industry tryna destroy cause he exposed they cash cow ,0,10,2,0,5.7,66,4
  nepal  rebuilding lives and livelihoods after quake devastation,1,10,2,1,9.4,103,8
diageo s ceo stresses that a board revolt at united spirits has not impacted indian operations,0,16,5,1,6.375,117,6
i m traumatised,0,3,1,0,8.666666666666666,28,2
what is the role of usg in paeds major trauma imaging decision tool ,0,15,5,0,4.666666666666667,84,3
i pledge allegiance to the p o p e  and the burning buildings of epic city   ,1,14,6,0,4.928571428571429,82,11
why did god order obliteration of ancient canaanites   via,0,11,3,1,7.727272727272727,95,7
4 5 out of 5 stars by 290 reviewers for  dragon blood  boxset by lindsay buroker,0,18,5,2,6.5,134,14
heavy rain gusty winds and vivid lightning moving east through the triad now ,1,14,3,1,6.214285714285714,100,6
this the same dude that obliterated meek mill  dont judge a book by its cover ,0,16,7,1,5.375,101,7
ultimate library   prepare yourself for any catastrophe  over,1,13,4,2,9.307692307692308,133,15
hillary mass murderer ,1,5,0,0,8.8,48,3
how many baskets did a charming fatality by get ,0,13,4,1,7.3076923076923075,108,9
sinkhole selfies  you wont believe what s in the brooklyn sinkhole  sinkhole sel ,0,15,4,1,7.533333333333333,136,14
i 10 eb at ms line update  offloading the hazardous material is going much slower than expected  road could stay closed until tomorrow am ,1,23,6,0,5.043478260869565,138,4
rly tragedy in mp  some live to recount horror  uiwhen i saw coaches of my train plunging into water i called  ,1,23,8,1,5.0,137,10
a group of florida forest service firefighters could be deployed to california to help contain fires  details at 10 ,1,20,7,1,6.0,139,7
were you opening regular or master packs  rt  sou  sunku 1 mil credits into light sideu  didn t pullu oneu you sure about those odds ,0,22,7,0,5.727272727272728,147,10
pop quiz  which do you prefer  feminist revolution or fried ravioliaewith porcini and ricottau ,0,16,5,2,7.9375,142,13
 creel you must think i m a real moron flag man  a brainless mass of muscle  i do but i don t think you re a mass murderer ,0,23,9,0,4.521739130434782,126,12
cyclone by double g would be the cherry on top to this outfit ,0,17,7,2,6.529411764705882,127,13
it works for my purpose  a large cyclone would be better  i just don t have  4k  this was  500,0,22,12,0,5.363636363636363,139,9
mbataweel  family members who killed in an airplane s accident,1,13,3,0,6.384615384615385,95,6
not  ready for this heat wave   i don t want the sun to come back out  i m enjoying this break of cooler temps ,1,23,9,0,4.043478260869565,115,10
into burning fucking buildings  2 2 ,1,5,1,0,6.4,36,3
young children among those rescued from capsized boat off libya  via,1,13,3,1,7.3076923076923075,107,6
the dress memes have officially exploded on the internet,1,10,4,1,7.0,79,5
photo  this is why i am scared to leave my car under trees in a storm  ,1,20,10,1,5.45,128,12
ad miles  hurricane of fun   the making of wet hot ,0,12,3,1,5.333333333333333,75,8
but if you build an army of 100 dogs and their leader is a lion all dogs will fight like a lion ,1,22,12,0,3.409090909090909,96,1
i don t see the option to buy the full collapse vinyl with tee bundle just the waiting ,0,18,8,0,4.611111111111111,100,3
i was going to tell him but you were body bagging him,0,13,8,0,3.692307692307693,60,1
after the green line derailment my concern for track that looks like this goes up a bit ,1,20,9,1,5.45,128,10
abc onlinemh370  aircraft debris found on la reunion is from missing malaysia airlines  abc onlinea piece of aircraft debris which  ,1,21,5,0,5.523809523809524,136,7
drunk meals 101  what to cook when you re totally obliterated,1,11,4,1,6.727272727272728,84,7
11 year old boy charged with manslaughter of toddler  report  an 11 year old boy has been charged with manslaughter over the fatal sh ,1,20,8,0,5.85,136,9
just thought i d let you all know  it s probably not a good idea to plug in your hairdryer when it s wet you will be electrocuted ,0,25,14,0,4.32,132,7
israeli helicopters that attacked civilians in gaza just completed exercises in greece ,1,12,4,0,6.333333333333333,87,1
yet another company trying to censor the internet  reddit has started to quarantine their content ,0,17,5,1,6.411764705882353,125,8
madhya pradesh train derailment  village youth saved many lives,1,9,0,0,6.111111111111111,63,1
imagine having kp and root  we d demolish everyone,0,8,3,0,5.75,53,5
devastated   ,0,3,0,0,10.0,32,7
diageo s ceo stresses that a board revolt at united spirits has not impacted indian operations,0,16,5,1,6.375,117,6
yo flex im here,0,6,1,1,7.333333333333333,49,6
good  play along with her  you may begin your operation with the death star  the evacuation is nearly complete ,0,21,7,0,5.714285714285714,140,6
alrighty hit me up and we ll blaze ,0,8,4,0,5.0,47,4
love how i don t get in any trouble for having people over and the house still being trashed,0,18,12,0,4.166666666666667,92,1
hibernating pbx irrespective of pitch fatality careerism pan  crbzfz,0,9,1,0,6.666666666666667,68,1
warne shocked over australia s epic collapse at trent bridge  johannesburg aug 06  ani  legendary australian ,1,16,2,1,7.5,135,13
i must be overlooking the burning buildings ,1,10,3,0,7.3,82,5
dear in the name of humanityi apologized to survivors r u ready to do so ,1,18,6,1,6.611111111111111,136,11
refugio oil spill may have been costlier bigger than projected,1,11,3,1,6.818181818181818,85,5
evacuation order lifted for roosevelt after misses town   komo news,1,13,2,1,6.769230769230769,100,7
maj muzzamil pilot offr of mi 17 crashed near mansehra today ,1,11,1,1,6.727272727272728,84,7
turn back to me  i have rescued you and swept away your sins as though they were clouds  isaiah 44 22 contemporary english version,0,23,9,0,4.695652173913044,130,3
our little forest fire wardens,1,6,1,1,8.0,53,5
our tipster previews chelsea v swansea  amp  there s a 48 1 double ,0,15,3,2,7.733333333333333,131,17
update  the police seemed like nice enough people  i felt bad when i transformed and they screamed  don t worry they re only unconscious ,0,22,10,0,5.363636363636363,139,8
failure is a misfortunebut regret is a catastrophe,0,8,4,0,5.375,50,0
aquarium ornament wreck sailing boat sunk ship destroyer fish tank cave decor   full read u ,1,18,0,2,6.777777777777778,139,12
latest   trains derailment   it s the freakiest of freak accidents    the indian express  the indi ,1,18,4,1,6.611111111111111,136,16
savings and sewing in guatemala  savings and sewing in guatemala  when a natural disaster hit seamstress elvia ,1,18,6,1,6.611111111111111,137,10
hwrf absolutely lashes taipei with hurricane force winds high storm surge and 20  of rain  not good news at all ,1,21,5,1,5.571428571428571,137,10
faan orders evacuation of abandoned aircraft at mma  faan noted that the action had become neces   via,1,19,5,1,6.2105263157894735,136,10
nws  flash flood warning continued for shelby county until 08 00 pm wednesday ,1,14,2,1,6.714285714285714,107,9
rss  judge orders texas to recognize spouse on same sex death certificate,0,12,2,1,7.083333333333333,97,7
11 year old boy charged with manslaughter of toddler  report  an 11 year old boy has been charged with manslaughter over the fatal sh ,1,20,8,0,5.85,136,9
to that time my best friend and i panicked at the disco ,0,14,7,1,5.142857142857143,85,7
i liked a video  kalle mattson    avalanche   official video ,0,12,2,1,6.75,92,11
holy crap it s been forever since i saw this movie but the nostalgia wave just hit me like a tsunami  thank youuu ,0,23,11,0,4.3478260869565215,122,4
olap pres   how to recognize a hazardous waste and the multidimensional,1,16,5,2,7.375,133,14
wreckage  conclusively confirmed  as from mh370  malaysia pm  investigators and the families of those who were ,1,17,7,1,7.0588235294117645,136,12
stepped outside with a drink and a cigarette and immediately locked eyes with a jogger  worlds really do collide ,0,19,8,0,5.0,113,2
 tries to electrocute self with phone cord ,0,8,2,0,5.875,54,3
episcopal priests on road trip with interracial family shares harrowing story of police harassment  via,0,17,3,1,7.0,135,6
psalms 34 22 the lord redeemeth the soul of his servants  and none of them that trust in him shall be desolate ,0,21,12,0,4.333333333333333,111,3
of course the one day i have to dress professionally aka unsensibly for class is the day i have try and outrun a natural disaster ,1,25,12,0,4.24,130,1
mattingly  amp  bundy  amp  mcgwire were standing on it when it collapsed ,1,15,5,0,6.4,110,8
4 police officers arrested for abusing children at police run boot camp in san luis obispo calif     ,1,20,3,1,6.0,139,12
guys  i have an imouto who isn t actually related to me by blood ,0,13,8,0,4.076923076923077,65,3
it s impossible for me too ww like i can t survive a day without meat wew,0,17,8,0,4.882352941176471,99,4
speaking of memorable debates  60 second know it all  ronald reagan s landslide romp on election day in 1980 m ,0,17,3,1,7.0588235294117645,136,14
true because of the truck that caught fire ,1,9,4,0,5.222222222222222,55,2
fyi   accident property damage 3460 limestone ln col yellowstone way fieldstone dr 08 05 2015 19 36 35,1,9,0,0,10.444444444444445,102,11
rt patrickjbutler  excellent damiengayle eyewitness account of kids company closure   you drop the bomb and expectu ,1,17,3,1,7.294117647058823,140,9
lmao fuckboy changed his   for damage control,0,9,2,0,5.555555555555555,58,2
oil and gas exploration takes seismic shift in gabon to somalia   bloomberg   ,1,16,3,1,6.3125,116,15
9 mile backup on i 77 south accident blocking the right 2 lanes at exit 31 langtree rd consider nc 115 or nc 150 to nc 16 as alternate,1,26,6,0,4.346153846153846,138,7
 let   me   be   your   hot   blazing   fantasy ,0,17,3,1,4.588235294117647,96,18
spokane authorities say they re struggling to solve arson cases like today s on hamilton ,1,15,4,2,8.066666666666666,135,13
he was   like he was singing so loud  ,0,11,6,0,4.363636363636363,58,10
toddler drowned in bath after mum left room to fetch his pyjamas,1,13,4,1,5.769230769230769,87,5
you happen to conveniently  forget  about how you zionists revere and  honour  mass murderer baruch goldstein ,1,17,6,1,6.941176470588236,135,10
we re   read about our latest opening here  emergency department psychiatric rn  90 fte day   ,0,18,3,1,6.277777777777778,130,14
zayn malik  amp  perrie edwards end engagement  sheus udevastatedu,1,11,0,2,9.818181818181818,118,13
i drowned in the kiddie pool and i lost my ploppy,0,11,6,0,3.5454545454545454,49,0
tonight we have attended a fire in romford with thankfully no injuries,1,14,6,1,6.571428571428571,105,6
salem 2 nuclear reactor shut down over electrical circuit failure on pump  the salem 2 nuclear reactor had bee ,1,20,5,1,5.85,136,9
ty for the follow go to  brutally abused desolate amp lost   her lovely mum dies is it murder ,0,17,5,1,6.764705882352941,131,13
ui  setsuko thurlow survived the bomb  this is her story ,1,13,4,2,9.23076923076923,132,15
calgary area tornado warnings end as thunderstorms move eastward,1,10,1,0,7.2,81,1
the latest  more homes razed by northern california wildfire   lynchburg news and advance,1,16,4,2,7.5,135,12
russia and that back fired now 2015 look what happened 911bombing of marine barracks suicide bombers attacks on world sites,1,21,5,0,5.523809523809524,137,1
i added a video to a playlist  ori and the bind forest ep 6  fire and death ,1,19,7,1,4.684210526315789,107,8
can still see it blank expression cheeks clapping in my face marvins room playing subtlety in the back yet drowning out all the sound,0,21,8,0,5.666666666666667,139,9
map  typhoon soudelor s predicted path as it approaches taiwan  expected to make landfall over southern china by su ,1,19,5,1,6.421052631578948,140,9
lol the real issue is the the way the nfl is trying to ruin this guy s legacy ,0,18,8,1,4.722222222222222,102,7
discovered plane debris is from missing malaysia airlines flight 370   time,1,13,2,1,6.615384615384615,98,6
connor franta  damn sirens i hope everyone is okay  dan howell  can you please get murdered on another street,1,19,6,0,4.789473684210527,111,3
road closures remain in effect due to hazard trees falling tree torching and uphill runs of the fire  forest service road remains close,1,24,5,0,4.791666666666667,138,2
there are a few people i d let ruin my life my soul my cervix my everything  odell is definitely top of that list ,0,23,12,0,4.0,114,3
read a schoolboyus eyewitness account of hiroshima,1,8,2,1,8.5,75,5
rail sends a message of condolence to vietnam following natural disaster  on behalf of the cuban government an ,1,19,6,1,6.2631578947368425,137,9
asics gt ii super red 2 0 11 ronnie fieg kith red white 3m x gel grey volcano 2,0,20,0,2,5.65,132,13
the first time i went swiming in it i was basically screaming why does it smell taste so bad,0,19,10,0,4.789473684210527,109,2
also me please i would very much like a link,0,12,7,0,5.166666666666667,73,3
3 years after the sikh temple massacre hate violence prevention is key  ,1,16,3,2,7.6875,138,14
in photos  the young refugees forced to flee burundi s violence   vice news  see more,1,17,4,2,6.764705882352941,131,13
oh wait i expected to go a totally different route in ls that was derailed by another barely passing grade in a required course  super ,0,25,9,0,4.44,135,2
attempting delany s dhalgren in beastly ny heat  downing hot coffee amongst descriptions of buildings burning for days without ruin ,0,19,3,0,6.0,132,3
my back is so sunburned  ,1,6,3,0,3.5,26,2
families to sue over legionnaires  more than 40 families affected by the fatal outbreak of legionnaires  disease in edinburgh are to  ,1,22,10,0,5.227272727272728,136,5
lucas duda is ghost rider  not the nic cage version but an actual  engulfed in flames  badass ,1,18,6,0,4.611111111111111,100,5
 but time began at last to obliterate the freshness of my alarm ,0,13,5,1,6.076923076923077,91,11
downtown emergency service center is hiring  counselor or intern in apply now ,0,17,3,1,7.176470588235294,138,11
one thing i wanna see before i die gt  standing in a good windstorm with no hat on ,0,19,7,0,4.421052631578948,102,7
what a feat  watch the of  s incredible music video for     ,0,15,5,1,6.666666666666667,114,15
usgs eq  m 1 9   5km s of volcano hawaii  time2015 08 06 01 04 01 utc2015 08 05 15 04 01  10 00 a ,1,18,1,1,6.555555555555555,135,23
dr  gridlock  hereus what may have caused a metro train to derail in downtown d c ,1,17,5,1,6.294117647058823,123,10
brooklyn locksmith  domesticate emergency mechanic services circa the clock movement  gba,0,12,1,1,8.5,113,8
two giant cranes holding a bridge collapse into nearby homes,1,11,2,1,6.636363636363637,83,5
tension in bayelsa as patience jonathan plans to hijack apc pdp  ,1,13,3,1,5.846153846153846,88,6
nine giant body sized garbage bags later i m just going to start throwing things away ,0,16,2,0,6.1875,114,7
pls can alllll the nittys evacuate stockwell,0,7,2,0,5.428571428571429,44,0
building muscle with feast and famine feeding most diet plans are based around losing weight but what should youu ,0,20,7,1,6.0,139,6
add these items to your everyday eating habits  please do the research on how to take with your bloodu ,0,20,10,1,5.45,128,7
 report 5  18 22 45 ibaraki prefecture offing m5 5 depth 60km maximum seismic intensity 4,1,14,0,0,6.285714285714286,101,6
wholesale markets ablaze,1,5,0,1,10.2,55,6
christian attacked by muslims at the temple mount after waving israeli flag via pamela geller    ,1,18,4,1,5.833333333333333,122,9
satan s daughter shadow warrior in 50ft women aka transgender mode ps nyc is about to fold extra extra center of bioterrorism,1,22,5,0,5.2727272727272725,137,3
for these californians it s like living in africa s sahel desert   just finding water a daily chore ,1,18,7,1,5.888888888888889,123,9
rascal flatts riot tour atlantic city beach concert august 20 2015 2 tickets,0,13,0,2,8.461538461538462,122,12
check out ameribag healthy back bag shoulder cross body backpack khaki tan beige nylon,0,16,1,1,6.25,115,6
dal news  wednesday s injury report  rb lance dunbar injures ankle is listed as day to day,0,15,2,1,6.6,113,10
eyewitness accounts of survivors of hiroshima gleaned from a number of oral history projects,1,15,5,1,6.8,116,5
louis vuitton monogram sophie limited edition clutch cross body bag   full read by ebay,0,17,1,2,6.882352941176471,133,11
c 130 specially modified to land in a stadium and rescue hostages in iran in 1980  submitt ,1,18,6,1,6.444444444444445,136,11
this just married turkish couple gave 4000 syrian refugees an incredible gift,1,13,2,1,8.0,116,7
moved in a crescent formation small trails of dust left in their wake as they moved ,0,19,7,0,6.052631578947368,133,4
severe storm weakening as it moves se towards lubbock area  outflow boundary may create dust and 50 mph gusts,1,20,3,1,5.65,133,6
little gecko chillin  in my garden  i ended up helping him out i suspected he might drown u ,0,18,8,1,5.555555555555555,117,9
malaysia confirms plane debris washed up on reunion island is from flight mh370,1,14,4,1,6.357142857142857,102,5
this is set to become a huge one month wonder   and then pornhub will be inundated ,1,17,6,1,5.529411764705882,110,12
tell me why or why not to adopt in this way maybe i overlooked something fatal for me  whyor why not ,0,21,12,0,3.857142857142857,101,2
damn that sinkhole on sunset ,1,5,2,0,5.6,32,4
thought it was a drought  ,1,7,3,1,7.0,55,8
w ugliness due 2 your  ugly  frat s bioterrorismi m she who s id u  tolewant g another in my home ,1,18,5,0,6.722222222222222,138,13
amazon deal   wait or buy ,0,7,1,1,6.142857142857143,49,7
another disaster waiting to happen and your allowing it ,1,10,3,1,7.2,81,8
photoset  littlebitofbass  silinski  ed sheeran onae the hobbit  the desolation of smaug  german premiere ,0,14,2,1,8.428571428571429,131,14
dazzle destroy the fun  ,0,5,1,0,4.2,25,2
she says that she d love to come help but the sea would  electrocute us all   ,0,16,6,0,4.8125,92,18
you will be held hostage by a radical group ,0,9,4,0,4.0,44,1
multiple buildings on fire in downtown hinton,1,9,2,2,9.22222222222222,91,10
police  assailant in latest us movie theatre attack was homeless had psychological issues,1,14,3,1,7.071428571428571,112,6
mane im not a raiders fan but they been in a drought  they need to go 10 6 lol,0,18,9,0,3.388888888888889,78,2
rt likened to the 39 steps and the good shepherd by the film producer the desolate garden on all here,0,22,10,1,5.2727272727272725,138,6
mini lalaloopsy dolls seed sunburst june seashore sweater snowstorm autumn spice   full reu ,0,16,0,2,7.75,139,12
i think the risk of losing and getting her nose flattened has a lot to do with it,0,22,11,0,5.090909090909091,133,5
this is why i am scared to leave my car under trees in a storm,1,19,10,1,5.473684210526316,123,9
and put the taint there and that all that the magisters did was to open the gates and let the blight get away from it,0,26,17,0,4.038461538461538,130,1
 i m there  bride  amp  groom on mountain cliff edge  ha ha just kidding  i will not ever be there  ha ha  ,0,23,6,1,4.739130434782608,131,15
act my age was a mess everyone was so wild it was so fun my videos a wreck,0,18,10,0,3.1666666666666665,74,0
familia  arm injury or head case ,1,7,1,0,6.0,48,3
wtf thomas edison after making the lightbulb used to electrocute animals to make everyone think teslas power was unsafe  wank,0,20,5,0,5.45,128,4
overturns on interstate  click here if you ve been in a crash gt ,1,14,7,2,8.5,132,15
homecoming queen killed on way home from the prom by flood waters ,1,14,4,1,6.285714285714286,101,7
investigators have said a virgin galactic spaceship crash was caused by structural failure after the co pilot  ,1,18,6,1,6.611111111111111,136,9
this machine really captured my attention ,1,12,2,1,9.75,128,12
selection september bridgeport men charged in home invasion police looking for burglar   ,1,14,2,1,7.071428571428571,112,7
17 killed in suarabia mosque suicide bombing a suicide bomber attacked a mosque in aseer south western saudi ,1,18,4,1,6.611111111111111,137,9
how many dogs do you have and are they all rescue dogs ,0,13,8,0,4.538461538461538,71,2
 biggest lead hazard in new england history  yeah let s nail these guys ,0,13,3,1,6.538461538461538,97,10
7 beyonce is my pick for  fan army,0,10,3,2,7.9,88,12
deaths 7,1,3,0,1,9.666666666666666,31,5
cameroon repatriating about 12000 nigerian refugees due to boko haram,1,12,2,1,7.5,101,6
photoset  hakogaku   aei am a kurd  i was born on a battlefield  raised on a battlefield  gunfire sirens ,1,19,8,1,5.894736842105263,130,14
emergency responders prepare for chemical disaster through hazmat training ,1,10,2,1,8.9,98,6
motors hot deals  gt gt   10x 27w 12v 24v led work light flood lamp tractor truck suv utv au ,0,21,0,2,5.9523809523809526,145,16
as anniversary nears atomic bomb survivors speak out against nuclear power  ,1,13,3,1,6.6923076923076925,99,6
what a wonderful day ,0,4,2,0,4.5,21,1
don t be like that babes  lt 3 you ll have a ball of fun with me at lan   ,0,18,11,0,4.166666666666667,92,8
black eye 9  a space battle occurred at star o784 involving 3 fleets totaling 3941 ships with 13 destroyed,0,19,3,0,4.631578947368421,106,1
hollywood movie about trapped miners released in chile,0,9,2,1,7.666666666666667,77,5
 lt  things  and what if we get attacked ,0,9,5,0,5.0,53,5
apollo brown ft  m o p  detonate  ,1,7,0,1,7.285714285714286,57,10
he was the lich king s first casualty block me back i hate you ,1,15,5,1,5.733333333333333,100,8
dysfunctional mcconnell plans on holding judicial nominations hostage  another example of how gop canut govern   u ,0,17,3,1,7.294117647058823,140,8
militants attack udhampur police post  2 spos injured,1,10,0,1,8.1,90,7
loan upheaval is the way in which oneself can save your house leaving out being foreclosed on tejc,0,17,8,0,4.941176470588236,100,3
video   we re picking up bodies from water  rescuers are searching for hundreds of migrants in the mediterranean after a boat carryi ,1,21,9,0,5.523809523809524,136,8
nieces these are especially good for you with the kids  megan swanger ruthann mccormick daisy henley ,0,17,6,1,6.470588235294118,127,9
man is equally incapable of seeing the nothingness from which he emerges and the infinity in which he is engulfed   blaise pascal,0,23,12,0,4.695652173913044,130,2
hermancranston  wired   reddit will now quarantine offensive content    u ,0,12,0,2,9.25,122,15
zicac vintage leather briefcase messenger satchel tote cross body handbags for womens,0,13,1,1,7.384615384615385,108,5
virgin galactic crash  early unlocking of brakes triggered structural failure  the crash of a virgin galactic  ,1,18,4,1,6.611111111111111,136,10
 also i dont think sewing thought a leather belt would work out that well lol ,0,15,5,0,4.266666666666667,78,2
c 130 specially modified to land in a stadium and rescue hostages in iran in 1980,1,19,6,1,5.631578947368421,126,9
new ran report from the frontlines of human rights abuses and forest destruction for fashion ,1,16,5,1,6.375,117,7
rt thr  rt thrarchives  1928  when leo the mgm lion survived a plane crash,1,17,3,2,6.470588235294118,126,15
is he about to crash  did the queen die  did something explode  who knows ,1,15,8,1,5.533333333333333,98,9
  mountains of debris from the japanese tsunami have floated to the west coast,1,15,6,1,7.0,119,10
like it affects every level of life you re expecting me to buy everything and still survive with my limited pocket money,0,21,9,0,4.761904761904762,120,1
hellfire is surrounded by desires so be careful and donut let your desires control you ,1,16,6,0,5.3125,100,2
nigerian boxer  who survived sessions with klitschko becomes famous on youtube,0,12,2,1,7.5,101,6
natural lubrication  ,0,3,0,0,13.666666666666666,43,12
at the lake  sees a dead fish  me  poor little guy i wonder what happened ashley  idk maybe it drowned wtf  ,0,22,6,0,4.2727272727272725,118,12
the af comments on  new evidence of japan s effort to build atom bomb at the end of wwii   ,1,19,6,1,5.052631578947368,114,10
jacksonville family bands together as memorial is planned for  ,1,11,3,1,7.090909090909091,90,8
a fierce windstorm can t take place without da calm stillness of the eye center so w  that said ur internal aspects weigh more than external,0,23,8,0,5.130434782608695,140,4
rt   homeless vulnerable during north texas heat wave,1,11,1,2,9.272727272727272,112,12
hollywood movie about trapped miners released in chile,0,8,2,0,5.875,54,0
can twon t tell how they d respond to an oil spill  trust them  see sec 4 2,1,18,4,1,6.777777777777778,139,15
phones offers  gt gt   8 pin lightning connector 2 1a car charger for apple 5 5s 5c 6 6  ipu ,0,20,1,2,6.3,145,19
watching it go up in flames,1,6,3,0,3.6666666666666665,27,0
the annihilation of jeb christie  amp  kasich is less than 24 hours away  please god allow me at least one more full day ,0,23,7,0,4.434782608695652,124,7
there s an emergency evacuation happening now in the building across the street,1,12,5,0,5.666666666666667,79,1
and i wrecked you both,0,7,4,0,6.0,48,3
thunder buddys ,0,4,0,0,9.25,40,3
the answer my friend is yelling in the wind my latest article for  read and share   thanks ,0,19,7,2,6.421052631578948,140,14
currently want to drive my car off a cliff and fall to my death ,0,14,7,0,3.642857142857143,64,1
reddit will now quarantine offensive content,0,10,0,1,10.0,109,10
grace  expect that large rocks trees mud unstable and or saturated land may slide  very hazardous in hilly mountain areas ,1,19,2,0,6.052631578947368,133,9
for the people who died in human experiments by unit 731 of japanese military,1,17,6,2,7.294117647058823,140,11
