text,target,word_count,stop_word_count,url_count,mean_word_length,char_count,punctuation_count
exquisite asian in sto ,0,11,1,1,7.090909090909091,88,14
last chance animal rescue has 3 new posts ,0,10,1,1,7.0,79,7
how did i miss that gary busey s son plays dixie on his electronic green fiddle during the post battle celebration sequence,0,20,8,0,5.2,123,2
motorcyclist bicyclist injured in denver collision on broadway  at least two people were taken to a localu ,1,18,6,1,6.333333333333333,131,7
today was trauma on top of trauma on top of trauma in richmond so i know work is going to be crazy the next two days,0,26,12,0,3.5,117,0
when you re taking a shower and someone flushes the toilet and you have  1 second to gtfo or you get burned ,0,21,12,0,6.523809523809524,157,52
explosion ,0,11,0,1,11.363636363636363,140,18
and please don t flood poor  s mentions  he s put in his work ,1,12,5,0,5.5,77,6
somehow find you and i collide,0,7,3,1,6.714285714285714,53,5
strikers in phalaborwa striking over the chinese taking their jobs  strikers burning buildings attacking cars 2 ,1,17,4,1,7.117647058823529,137,9
smoke whatever you got,0,4,1,0,4.75,22,0
japan marks 70th anniversary of hiroshima atomic bombing  bells tolled in hiroshima on thursday as japan marked 70u ,1,19,4,1,6.421052631578948,140,7
so it looks like my profile shall be no more  nothing left to offer  dj mixes obliterated  ,0,20,8,0,5.15,122,6
towboat trek sympathy deluge falls  vtc,1,7,0,1,8.0,62,6
or the rioting in happy valley after penn state loses ,0,11,4,0,5.181818181818182,67,2
destroy oppa image  oops  there s nothing left right  haaaaaa,0,10,1,0,6.9,78,5
i bet you didnt know i kick box too ,0,10,3,1,5.1,60,6
 forbes  china s stock market crash  are there gems in the rubble  chinaus stock market crash this summer ha ,0,19,5,1,6.315789473684211,138,15
the most generous bride on earth  couple feeds 4000 syrian refugees on their wedding day  via love it ,0,20,5,1,6.0,139,8
commoditiesaeare crashing like it s 2008 all over again  via,0,11,5,1,7.454545454545454,92,7
its not funny im traumatised,0,6,2,0,6.5,44,2
womem crush wednesday  ,0,5,0,0,9.8,53,19
decree results in destruction of 10 tons of imported cheese near russia ukraine border  rt,1,17,3,1,6.882352941176471,133,9
bleeding on the brain don t know the cause,0,9,4,0,5.222222222222222,55,2
refugio oil spill may have been costlier bigger than projected,1,11,3,1,6.818181818181818,85,5
i love the song  healing is here deluge   amp wanted to sing it at my church but it s not in spanish so i translated it ,0,24,13,1,5.0,143,12
accident on i 24 w   traffic moving 8m slower than usual ,1,12,2,1,7.25,98,9
11 year old boy charged with manslaughter of toddler  report  an 11 year old boy has been charged with manslaughter over the fatal sh ,1,20,8,0,5.85,136,9
new explosion proof tempered glass screen protector film for blackberry z10   full read byu ,0,16,1,2,7.75,139,13
don avoid wearing dead black flaming red and stark white so much and esp  at debate  go with your blue gold brown even to shoes  and,0,26,8,0,4.115384615384615,132,3
thank you  drove by the mayhem  how scary   stacy,0,10,3,0,5.3,62,6
wild fires in california  must be global warming  can t just be extreme heat combined with dry foliage ignited by some douchebag hiker ,1,22,8,0,5.2727272727272725,137,6
why are people panicking about results day though hahahah like worrying is going to change your results,0,17,7,0,5.117647058823529,103,0
can we have a public vote for the next annual village disaster  i want an isis strike or a nuclear accident  amp  end this forever,1,26,11,0,4.461538461538462,142,4
salvation army hosts rally to reconnect fathers with children  the salvation army is hosting a back to school rallyu ,1,20,6,1,6.1,141,7
status  last seen buying body bags ,0,6,0,0,5.0,35,2
kai forbath just demolished a weather station set up on a drill field with a missed field goal  thing just exploded into metal bits ,1,24,9,0,4.541666666666667,132,2
70 years after atomic bombs japan still struggles with war past  the anniversary of the devastation wrought b ,1,19,5,1,6.157894736842105,135,9
talent  misdirection cyclone pass ignite pass vanishing drive phantom shot,1,11,0,0,6.818181818181818,86,2
73rd goode water ski national championships will go on as planned next week   event w  damage from a tornado on mon ,1,22,5,1,5.363636363636363,140,9
i visited hiroshima in 2006  it is an incredible place  this model shows devastation of the bomb ,1,18,8,1,5.722222222222222,120,8
the thirst has no curfew  ,0,9,3,0,7.888888888888889,79,15
me  amp  you both  amp  i ll be dam if i get any of that drought bud,0,17,11,0,4.0588235294117645,85,7
save the upset and stress of upheaval and let us help keep people independent ,0,19,4,0,6.105263157894737,134,6
two hours to get to a client meeting  whirlwind of emotions with this,1,14,7,0,4.857142857142857,81,2
a new type of adhd  head injuries in children linked to long term attention problems,0,15,4,1,6.2,107,7
ron  amp  fez   dave s high school crush  via,1,11,0,1,6.090909090909091,77,10
yeah i agree but it s the shock factor that ropes people in if they just show devastation then it angers me,0,22,12,0,4.363636363636363,117,2
u s national park services tonto national forest  stop the annihilation of the salt river wild horse   via,0,19,3,1,6.368421052631579,139,11
okay the cat has been quarantined in my bathroom its meowing really loud but i turned up the tv louder things just might work out okay,0,24,11,0,4.791666666666667,138,6
that day remember the nuclear weapon power hiroshima 70th,1,8,2,0,6.875,62,6
coastal german shepherd rescue oc shared a link    ,0,12,1,2,8.5,113,15
then you have rise of coates charleston massacre walter scott and black twitter more broadly as well ,1,19,7,0,5.947368421052632,131,3
california cops have sketch of gunman who killed one wounded two deputies via the app,1,17,4,1,5.941176470588236,117,6
disaster control teams are studying ways to evacuate the port area in response to tidal wave warnings 900037 ,1,17,5,0,5.529411764705882,110,3
no bc we always got in trouble for laughing too much  ,0,13,5,0,4.461538461538462,70,4
summer heat drives bobcats to calgary backyards   3,1,11,1,2,7.909090909090909,97,11
shit is hard to get over but sometimes the tragedy means it s over soulja ,1,14,8,0,4.428571428571429,75,3
this is an evil generation rock and roll evacuation  as far as the eye can see   hey hey hey hey ,0,20,8,0,3.95,98,5
aannnnd    reddit will now quarantine offensive content ,0,9,0,1,8.0,80,8
i m not a drake fan but i enjoy seeing him body bagging people  great marketing lol ,0,15,6,0,4.666666666666667,84,4
you made my mood go from shitty af to panicking af istg,0,12,4,0,3.6666666666666665,55,0
bbc news   india rail crash  trains derail in madhya pradesh flash flood,1,14,1,1,5.857142857142857,95,7
25 killed 50 injured in madhya pradesh twin train derailment,1,12,1,2,7.916666666666667,106,10
imagine a room with walls that are lava lamps ,1,9,4,0,4.222222222222222,46,1
oops  h bomb lost 70 miles off the okinawan coast  fell off the ship 1965 ,1,16,4,1,5.125,97,8
bolshevik government monopolized food supply to seize power over hunhry population  artificial famine was the result,1,17,4,1,7.294117647058823,140,6
people with a out there  are u allowed to donate blood and receive blood as well or not ,1,19,8,0,4.157894736842105,97,4
investigators rule catastrophic structural failure resulted in 2014 virg  related articles ,1,12,1,1,8.666666666666666,115,8
second tornado confirmed in sundayus storm,1,7,1,1,8.714285714285714,67,5
good for her lol,0,5,2,1,7.0,39,5
that moment when you get on a scary roller coaster and the guy behind you is just screaming bloody murder  ,0,23,11,0,4.956521739130435,136,8
boy saves autistic brother from drowning  a nine year old in maine dove into a pool to save his autistic brother from drowning,1,21,8,0,5.047619047619048,126,3
to the largest moblin s he d leaving the biggest one for red and fired  with one strike already the threat was reduced  gt ,0,23,9,0,5.043478260869565,138,9
severe thunderstorm warning for oklahoma county in ok until 10 30pm cdt ,1,12,3,0,5.583333333333333,78,3
tube strike   absolute pandemonium,0,5,0,0,6.0,34,1
rip mama but i m still thuggin cause the world is a war zone,0,13,5,0,3.692307692307693,60,1
cleared incident with injury i 495 inner loop exit 31   md 97 georgia ave silver spring,1,13,1,0,5.769230769230769,88,5
christian attacked by muslims at the temple mount after waving israeli flag via pamela geller    ,1,18,4,1,5.833333333333333,122,9
i added a video to a playlist  doc  volcanoes and earthquakes   inside the volcano,1,17,6,1,5.705882352941177,113,8
wreckage  conclusively confirmed  as from mh370  malaysia pm  investigators and the families of those who were ,1,17,7,1,7.0588235294117645,136,12
 i never understood guys who wanted to run into burning buildings   you chase murderers   not if they re on fire ,0,19,6,0,5.157894736842105,116,10
ohgod xd i didn t mean it so  p but you have that fire truck in the back of you to make up for it so you good xd,0,29,18,0,3.3793103448275863,126,3
deepak chopra s epic twitter meltdown,0,6,0,1,9.166666666666666,60,6
block the plate with a charging schwarber coming down the line cervelli  i dare you  you would explode into a little puff of smoke,0,24,11,0,4.458333333333333,130,2
outdoor siren test 2pm   the fgcu siren will be tested at 2pm today  another message will be sent when the test is concluded ,0,24,7,0,4.291666666666667,126,4
can you recommend anyone for this   rn emergency services full time 3p   3 30a rose de lima campus  ,0,22,4,1,5.227272727272728,136,12
there is no greater tragedy than becoming comfortable with where you are in life ,0,14,9,0,4.857142857142857,81,1
authorities allay fears ahead of rio olympic equestrian test event  via,1,15,1,1,7.733333333333333,130,8
 it s an eerie way of revealing both our history and our possible fate  by,0,18,7,1,6.388888888888889,132,12
info r  curfew in oper until 2030 z  taxiways foxtrot 5  amp  foxtrot 6 navbl  wnd  060 5  exp inst apch  rwy 05  damp  tmp  10  qnh  1028 ,0,27,2,0,4.185185185185185,139,15
new documents found pointing to japan s wwii atomic bomb program,1,11,1,1,7.0,87,6
seeing as how this person is a mass murderer and has like fbi cia grade equipment to do evil shit ,0,20,10,0,3.95,98,1
omg omg omg and have collided in a nuclear accident at  oo ,0,17,5,1,6.764705882352941,132,11
vladimir putin issues major warning but is it too late to escape armageddon ,1,14,5,1,6.142857142857143,99,6
shed innocent blood of their sons and daughters and the land was polluted psalms 106 38 help stop the sin of abortion ,0,21,8,0,4.666666666666667,119,2
photographer brian ruebs endures 4500 feet climb to capture bride and groom,0,12,2,1,7.25,98,6
ok peace i hope i fall off a cliff along with my dignity,1,13,6,0,3.3846153846153846,56,0
i added a video to a playlist  world of tanks   battle assistant mod bat chat arti kaboom,0,20,5,1,5.05,120,7
hunger hits me and i can t function probably wouldn t last long in famine zones thank god ,0,15,6,0,5.333333333333333,94,8
ui  you re a lot safer that way uyeah a lot more stable  amp  if i get in trouble i have a seat right there,0,25,13,0,4.92,147,8
a1  i started writing when i couldn t talk about my trauma in therapy it was the only way i could communicate,0,22,13,0,4.590909090909091,122,3
it may seem like our fire has been a little burnt out ,0,12,6,0,3.8333333333333335,57,4
update m e  confirms 2 women pulled from burning house died last friday  91 yr old edna jefferson amp doris sherfield72 ,1,18,1,1,7.0,143,12
        mh370  aircraft debris found on la reunion is from missing malaysia airlines  ,1,18,3,1,5.888888888888889,124,25
crying out for more  set me ablaze,0,7,3,0,4.0,34,1
a new favorite  desolate 2 by r3do  on,0,10,3,1,6.4,73,7
boy 11 charged with manslaughter in shooting death of elijah walker,1,12,3,1,6.583333333333333,90,5
plane debris is from missing mh370,1,7,2,1,7.285714285714286,57,5
i just remember us driving and singing collide together,0,9,3,0,5.222222222222222,55,0
hope dorett s  mudslide  cake wins ,0,6,0,0,6.166666666666667,42,6
unions say they are supportive of  london  yet are prepared to damage it economically   a300m last time ,0,18,6,1,6.222222222222222,129,10
i liked a video  minecraft  episode 2  blaze farm beginnings ,0,12,2,1,6.833333333333333,93,10
the things we fear most in organizations fluctuations disturbances imbalances are the primary sources of creativity    margaret wheatley,0,17,6,0,7.176470588235294,138,6
sure i just burned about 100 calories after eating a giant bowl of mac and cheese so i totally earned this 300 calorie klondike bar ,0,25,10,0,4.32,132,1
on the freeway to africa til i wrecked my audi,0,10,5,0,3.7,46,0
how is it one careless match can start a forest fire but it takes a whole box to start a campfire,0,21,10,0,3.6666666666666665,97,0
  texas seeks comment on rules for changes to windstorm insurer,0,12,3,1,7.083333333333333,96,7
        suicide bomber kills 15 in saudi security site mosque   reuters,1,16,1,1,5.5625,105,20
it is indeed  if the apocalypse comes this week i know where i ll be  ,0,16,9,0,4.5625,88,5
eating takis then rubbing my eyes with my hands now my eyes are bleeding tears,0,15,6,0,4.266666666666667,78,0
at this point i expect to hear reports about a metrobus being derailed ,1,15,7,0,5.533333333333333,97,3
black eye 9  a space battle occurred at star o784 involving 3 fleets totaling 3945 ships with 17 destroyed,0,19,3,0,4.631578947368421,106,1
interview with actor randy irwin a s k what could be the harm,0,12,5,1,6.083333333333333,84,7
pissed at you and could have their pikachu electrocute you and  ,0,13,8,0,5.307692307692308,81,5
why you screamed,0,8,2,0,10.0,87,8
it s 11 30 and i m already panicking and crying bc i m so stressed nice,0,13,6,0,4.538461538461538,71,4
it s crazy how a phone can do so much damage to a person,0,13,8,0,3.3846153846153846,56,1
the ashes test match is currently more interesting than stupid congress rioting ,1,12,4,0,5.916666666666667,82,3
24 killed in two simultaneous rail crash as acute floods derail the two trains  ,1,17,3,1,6.0588235294117645,119,10
oops  bounty hunters try to raid phoenix police chief s home  a group of armed bounty hunters surrounded the h ,1,20,4,1,5.85,136,11
don t let phil help out he ll probably electrocute himself,0,10,4,0,6.5,74,3
dtn brazil  refugio oil spill may have been costlier bigger than projected  a plains all american pipeline oi ,1,19,5,1,6.157894736842105,135,10
families to sue over legionnaires  more than 40 families affected by the fatal outbreak of legionnaires  disea ,1,18,7,1,6.611111111111111,136,10
estimated damage and fatalities of an hiroshima sized atomic bomb dropped on your hometown  ,1,16,5,1,7.0625,129,8
950  if a landslide tumbles down todayi m on your side and if a twister sweeps it all away  you re on your own bitch runs into distance ,1,25,15,0,4.52,139,7
screams and gets a face full of saku genitals,0,11,3,0,5.636363636363637,74,6
mango juice with crushed ice gt gt gt gt ,0,5,1,0,8.4,46,10
help yourself or those you love who suffer from self esteem wounds  you can today ,0,16,8,2,7.0625,128,13
all injuries pre foster floyd  those will be covered next week ,0,11,3,1,7.0,87,8
the real question is why is the tornado siren going off in dyersburg ,1,13,7,0,4.384615384615385,69,1
still and box alarm for the train derailment at 61st and calumet struck out on the orders of 2 1 21 ,1,20,9,0,4.85,116,4
why did god order obliteration of ancient canaanites   via,0,11,3,1,7.727272727272727,95,7
in odai bucharest romania 600 dogs dying they are so hungry that they eat each other ,1,17,6,1,6.0588235294117645,119,8
it got pretty windy here too  but no damage ,0,10,4,0,5.3,62,5
indeed ray devastation would be far more comprehensive,1,10,3,0,7.2,81,2
not upset with a rally upset with burning buildings businesses executing cops that have nothing to do with it etc,1,21,10,0,5.238095238095238,130,1
my pc account got hacked  someone tried to pull out over 1200 bucks which wasn t there now i have an nsf  amp  no idea who or why,0,28,14,0,4.142857142857143,143,6
damage to school bus on 80 in multi car crash,1,11,3,0,4.090909090909091,56,1
watch this airport get swallowed up by a sandstorm in under a minute,1,14,8,1,5.571428571428571,91,5
new level of tita dom  bowling injury ,0,7,1,1,7.857142857142857,61,8
the majority of those killed were civilians on the ground after the jet first bombed the city s main street then dramatically plummeted,1,22,10,0,5.181818181818182,135,1
uwe can helpu says denver firefighter working to curb first responder suicide,1,13,2,1,7.076923076923077,104,5
america like south africa is a traumatised sick country   in different ways of course   but still messed up ,0,20,6,0,4.45,108,3
i liked a video from  s 109   sn   vabengal  zss  vs  sws   fatality  captain falcon ,0,21,3,1,5.238095238095238,130,16
wwe 2k15  universe mode   part 149   obliterate   via,0,12,0,1,6.25,86,12
ik only troll his pol rivals never literally abused them or attacked their families  while all of them literally abuse ik  loosers,0,22,9,0,4.954545454545454,130,2
fedex no longer to transport bioterror germs in wake of anthrax lab mishaps,1,14,4,1,6.071428571428571,98,5
punjab government flood relief platform   realtime information on inundation damages rescue efforts  amp  travel alerts,1,16,1,1,7.875,141,8
jax issues hazardous weather outlook  hwo ,1,8,0,1,7.75,70,8
do you ever just want to obliterate an entire species off the face of the earth  i vote for mosquitoes,0,20,12,0,4.15,102,1
hopefully it doesn t electrocute your heated blanket lmao,0,9,3,0,7.222222222222222,73,3
owner of chicago area gay bar admits to arson scheme  frank elliott pleaded guilty to hiring an arsonist to to ,0,20,5,1,5.85,136,10
11 year old boy charged with manslaughter of toddler  report  an 11 year old boy has been charged with manslaughter over the fatal sh ,1,20,8,0,5.85,136,9
deep crew to help with california wild fires  via,1,11,2,1,6.454545454545454,81,6
answer to  s  break law on the minuscule chance a mass murderer shows up ,1,16,4,1,6.0,111,10
he thrusts a little more before he jams his cock deep inside her flooding her womb and pussy with his hot thick cum,0,24,11,0,4.458333333333333,130,2
the anniversary of the devastation wrought by the first military use of an atomic weapon cu ,1,20,7,1,6.0,140,9
remove the  and linkury browser hijacker,1,9,2,3,11.11111111111111,108,15
mariah getting thick in the shoulders poor girl ,1,8,2,0,5.125,48,1
twelve feared killed in pakistani air ambulance helicopter crash,1,11,1,2,9.090909090909092,110,10
 withering  to death  is an album found when he  undermine d his backyard because his cat  inundated  the floor  mustering  cat food ,0,21,9,0,5.380952380952381,133,10
uransomwareu holds b c  manus computer files hostage  a virus locked andrew wilson s family photos and otheru ,0,17,2,1,7.294117647058823,140,10
scene of the derailment  cta green line at 63rd prairie,1,10,3,1,7.0,79,8
what s wrong with just a lil smoke and good conversation  ,0,11,5,0,4.636363636363637,61,5
funtenna  hijacking computers to send data as sound waves  black hat 2015 ,0,16,2,1,6.4375,119,11
0 day bug in fully patched os x comes under active exploit to bypass password     ars technica,0,19,3,1,5.315789473684211,119,10
global precipitation measurement satellite captures 3 d image of typhoon soudelor   nasahurricane  visit ,1,14,1,1,8.214285714285714,128,9
i m sure the shop is deluged by local children wanting to buy it  really ,0,15,5,0,4.933333333333334,88,4
love you  amp  can t wait until collide ,0,8,3,0,6.375,59,12
fr cuz i risk being electrocuted every shower  ,0,10,2,1,6.3,72,7
arson suspect linked to 30 fires caught in northern california,1,11,2,1,6.818181818181818,85,5
pendleton media office said only fire on base right now is the horno blaze ,1,14,4,0,4.428571428571429,75,1
new item  pillow covers any size pillow cover grey pillow pillows premier prints lulu storm grey by mypillowstudio u ,0,20,2,1,6.1,141,7
iof murdered over 513 palestinian children  70  under 12  during gaza massacre where was zionist morality zionism is a world evil ,1,21,7,0,5.666666666666667,139,6
i m on fire ,0,4,2,1,8.0,36,7
also are you aware of the casualty estimates for an invasion of japan s home islands ,1,19,8,0,6.2105263157894735,136,6
grow calgary avoids worst of city s wicked weather     16,1,13,1,2,7.0,103,13
hurricane guillermo live noaa tracking   looping wed aug 5th     ,1,13,0,3,9.307692307692308,134,20
i didn t want to hurt you but the fear drove me to do it   midnight,0,16,9,0,4.125,81,16
an is group suicide bomber detonated an explosives packed vest in a mosque inside a saudi special forces headquarters killing 15 people ,1,21,6,0,5.523809523809524,136,2
pray  for east coast forest fires  pray  that they be put out  pray  for rain ,1,15,5,0,4.266666666666667,78,6
storm headed towards idaho falls with blowing dust  amp  winds to 60 mph  us hwy 20  amp  i15 look out ,1,22,2,1,5.045454545454546,134,12
the straight bass dubloadz droppd when they opened   meltdown had everyone meelllttting,0,14,4,1,6.928571428571429,110,6
i ll ruin my life if i have to ,0,8,5,0,3.0,31,2
crews working to restore power in southwest omaha after vehicle collided with utility pole   ,1,16,4,1,6.3125,116,7
the worst voice i can ever hear is the  nikki your in trouble  voice from my mom,0,17,10,0,3.764705882352941,81,2
rt  40hourfamine  in government has not declared floods an emergency  will continue to mu ,1,17,5,1,7.235294117647059,139,11
severe thunderstorm warning for oklahoma county until 10 30pm  radar here ,1,12,2,1,7.666666666666667,103,9
new isis video  isis threatens to behead croatian hostage within 48 hours   tlvfaces   tlvfaces,1,17,1,1,6.411764705882353,125,9
rt abbswinston  demolish tire repair shop structure in,1,13,1,2,9.153846153846152,131,14
islamic state group threatens to kill hostage if umuslim womenu arenut let go  ,1,15,2,1,6.466666666666667,111,9
 blight,0,2,0,0,9.0,19,2
it s time to reduce gun deaths,1,7,2,1,6.714285714285714,53,6
contruction upgrading ferries to earthquake standards in vashon mukilteo  the upgrades will bring the vulnera ,1,16,4,1,7.5,135,9
san bernardino i10 w eo   redlands blvd  trfc collision no inj ,0,12,0,1,6.416666666666667,88,11
what s up man ,0,3,2,0,4.0,14,2
apollo brown uo detonate f  m o p ,0,8,0,1,7.125,64,10
 some hearths they burn like a wildfire   by bees knees,1,11,4,1,6.181818181818182,78,7
you messed up my feeling like a hurricane damaged this broken home,0,12,6,0,4.583333333333333,66,0
3 options to fix your facebook cover violation  and keep the police away ,0,17,4,1,6.588235294117647,128,9
truth ,1,13,0,2,8.307692307692308,120,23
i liked a video  eminem feat  nate dogg   till i collapse,0,14,3,1,5.357142857142857,88,8
just absolutely obliterated a moth my new purchase is boss,0,10,4,0,4.9,58,0
not only does he know the latest research the kiddo s gi specialist sang the volcano number from inside out  now that is whole person care ,1,25,10,0,4.6,139,3
i agree with background checks  i just think guns or weapons in general are the great equalizer ,0,19,8,0,5.421052631578948,121,4
back in 02 to 03 would never said that 50 would have ended ja like obliteration,0,16,7,0,4.0,79,0
obama keeps 27 iraqi christian asylum seekers ndetention while flooding u s  w unscreened muslims   via,1,16,1,1,7.8125,140,10
a poignant reminder that in war there are many casualties ,1,11,5,1,6.454545454545454,81,6
pretty much every time the audio dies on an audio stream for a baseball game i assume catastrophic nuclear attack ,0,20,6,0,4.75,114,1
house energy  amp amp  commerce subcommittee to hold 7 28 hearing of cdc oversight of bioterror labs army anthrax mishaps  httu ,1,19,3,0,5.842105263157895,129,6
why does it say silas sliced in that headlinelike someone chopped him up like a piece of cabbage ,0,19,10,0,5.578947368421052,125,25
yet still why did so many fish die in the worldwide flood  i wonder ,0,19,6,0,5.947368421052632,131,8
megadeth week   symphony of destruction,0,7,1,1,8.0,62,6
emergency units simulate a chemical explosion at nu  suppose a student in the research labs at northwesternu ,1,18,6,1,6.444444444444445,133,7
survival kit whistle fire starter wire saw cree torch emergency blanket s knife   full reu ,1,18,0,2,6.722222222222222,139,12
11000 seeds 30 vegetable fruit variety garden kit emergency survival gear mre   full reau ,0,17,0,2,7.117647058823529,138,12
video   we re picking up bodies from water    bbc news   home  rescuers are searching for hundreds of ,1,20,4,1,5.9,138,15
the first piece of wreckage from the first ever lost boeing 777 which vanished back in early march along with the 239 people on board has,1,25,10,0,4.52,137,1
mh370  aircraft debris found on la reunion is from missing malaysia airlines     abc onlin   g,1,20,3,1,5.85,136,15
a demolished palestinian village comes back to life,1,9,2,1,7.333333333333333,74,5
free ebay sniping rt   chevrolet   avalanche ltz lifted 4x4 truck  please favorite  amp  share,0,16,0,1,6.3125,116,10
ancient mayan tablet found via,0,9,0,4,12.666666666666666,122,20
obama declares disaster for typhoon devastated saipan  obama signs disaster declaration for northern marians a ,1,15,2,1,8.133333333333333,136,10
a random hole just broke out in the street  ,0,11,5,1,5.2727272727272725,68,7
ill only dm hotel info because people are flooding my notifications asking me for info,0,15,6,0,4.8,86,0
uirichmond coaches were devastated to hear of the death of their second driver mr chance who was sittingu  jam ,1,20,8,1,6.0,139,10
smoke the weed   snoop lion ft  collie buddz,0,9,1,0,4.0,44,2
aren t dangling piercing crystals potentially hazardous to the eyes   ,0,11,3,0,6.181818181818182,78,5
my mic and controllers aren t working one second,0,8,3,0,5.125,48,1
