text,target,word_count,stop_word_count,url_count,mean_word_length,char_count,punctuation_count
does the opening scene of harry potter and the order of the phoenix remind anyone else of the movie twister  just me  okay,0,23,11,0,4.3478260869565215,122,2
metal cutting sparks brush fire in brighton  a brush fire that was sparked by a landowner cutting metal burned 10u ,1,21,6,1,5.666666666666667,139,7
experts in france begin examining airplane debris found on reunion island  french air accident experts on wednesday began examining t ,1,20,3,0,5.85,136,4
bank manager asks tom in an interview   what is cyclone  tom   it is the loan given to purchase a bicycle ,0,20,7,0,4.35,106,6
and when will you be commenting on ian taylor s dealings with mass   murderer arkan ,1,16,6,0,5.3125,100,4
4 equipment ego break upon dig your family internet hoke excepting versus a sinking term  dfljev,1,16,2,0,5.0625,96,1
thank you uplifting spirit  when im drowned you ve been an anchor,0,11,5,0,5.0,65,2
i still don t know why independence day and social casualty are not on the rowyso setlist these songs would be so good live,0,23,12,0,4.391304347826087,123,1
katherine s death,0,5,0,1,13.0,70,8
any lengths to rescue a cat in need ,0,9,4,1,5.666666666666667,59,6
so we should send it all 2 him then  drown him in it  i like the way u think ,0,23,11,0,5.086956521739131,139,7
slightly doesn t help that he has suh and wake in practice  but think he will get there  a lot of weapons ,0,23,11,1,5.0,138,10
accident with injuries on sb at cr 516 leonardville rd,1,11,3,1,6.636363636363637,83,7
some drugs and alcohol in jackson vroman house ,0,9,3,1,6.888888888888889,71,6
i liked a video from  mk x tremors stalag might fatality on ermac tournament pharaoh,0,18,4,1,6.055555555555555,126,7
i m drowning in spirits to wash you out,0,8,5,0,4.0,39,1
me trying to pass lax with my family ends up by me having to run after the ball after it gets bombed over my head,0,25,15,0,3.56,113,0
you may know me from such roles as terrorist,0,11,5,1,5.454545454545454,70,6
rt alisonannyoung  exclusive  fedex no longer to transport research specimens of bioterror pathogens in wake of anthrax lab mishaps u ,0,20,5,0,5.8,135,3
mh370 victim s family furious the media was told about wreckage confirmation first,1,13,3,1,7.153846153846154,105,6
china s stock market crash  are there gems in the rubble  chinaus stock market crash this su     via,0,20,5,1,5.9,138,16
beforeitsnews   global derivatives   1 5 quadrillion time bomb   vu ,0,12,0,3,10.583333333333334,138,22
it s okay i welcome the rain  gave you all the storm that you could weather ,0,15,9,0,4.133333333333334,77,3
orange  amp  blue line riders  expect delays downtown due to a sinkhole that s developed in the vicinity of 4th  amp  c street ,1,23,6,0,5.0,137,8
are you another stand user  if you are i will have to detonate you with my killer queen ,0,18,11,0,4.666666666666667,101,4
pic of 16yr old pkk suicide bomber who detonated bomb in turkey army trench released,1,17,3,2,6.705882352941177,130,10
she s a suicide bomb,0,4,2,0,4.25,20,1
death on railway track  why rains cannot take all the blame  derailment is not very common  last year less th ,1,21,8,1,5.523809523809524,136,12
news   islamic state claims suicide bombing at saudi arabian mosque ,1,11,1,1,7.363636363636363,91,8
no ways  a video for  stretcher ,0,7,3,0,6.285714285714286,51,9
going to redo my nails and watch behind the scenes of desolation of smaug ayyy,1,15,6,0,4.266666666666667,78,0
this is the natural and unavoidable consequence of socialism everywhere it has been tried   e,0,16,8,1,6.25,115,6
tips so that finding the customers ego drought  dqsvyusy,0,9,3,0,5.333333333333333,56,1
when you got an extension cord that extends from your bed to your bath tub   lets pray i don t electrocute myself,0,22,11,0,4.227272727272728,114,3
the walking dead spin off fear the walking dead is on the 23rd  ,1,14,6,0,4.0,69,6
most welcome  organizing twitter to find the important stuff amongst the deluge  btw loving the music and signed up for the ep ,0,23,9,0,5.043478260869565,138,4
 screams internally ,0,2,0,0,9.5,20,2
hollywood movie about trapped miners released in chile   the 33  hollywood movie about trapped miners starring ,1,17,3,1,7.0588235294117645,136,11
rt    desolation run  till 8 7 ,0,14,0,2,9.0,139,23
i liked a video from  minecraft skywars   o blaze que usa hack e flechadas sinistras ,0,19,3,1,5.631578947368421,125,9
learn how i gained access to the secrets of the top earners  amp  used them to explode my home business here   please,0,24,9,1,5.0,143,9
twelve feared killed in pakistani air ambulance helicopter crash,1,11,1,2,9.090909090909092,110,10
how many trains derailed that has to shut down orange blue in most of dc  the avengers made less of a mess,1,23,11,0,4.608695652173913,128,4
  china s stock market crash  are there gems in the rubble ,1,12,4,1,6.25,86,10
okay i can t find it so i m kinda panicking,0,9,5,0,3.888888888888889,43,2
yea heard about that not coming out until 2017 and 2019   vampiro is bleeding,0,15,5,0,5.466666666666667,96,9
i went to pick up my lunch today and the bartender was holding my change hostage because he wanted my number   ,1,22,11,0,4.136363636363637,112,3
i sent my emails why are the trinna hold me hostage rapping me up  ,0,15,8,0,3.6,69,2
russian  food crematoria  provoke outrage amid crisis famine memories  moscow  reuters    russian government  ,1,16,0,1,7.5,135,14
the city has activated the municipal emergency plan  primarily stay indoors avoid flooded areas call 311 for ,1,18,3,1,6.5,134,9
officially skipping out on  whatever the hashtag is  it s getting annihilated in reviews  bummer ,0,14,5,0,7.785714285714286,122,8
dramatic video shows plane landing during violent storm,1,9,1,1,7.777777777777778,78,5
that looks so desolate and just depressing,1,7,3,0,7.142857142857143,56,5
  to what degree has obama s efforts to institute sharia law exacerbated the california wild fires ,1,16,5,0,6.4375,119,4
dramatic video shows plane landing during violent storm  ,1,11,1,2,8.454545454545455,103,11
nah man he s panicking  he just found out his brothers had it off with his now wife debbie is in hospital he s stressed,0,24,13,0,4.5,131,4
the municipal emergency plan is now in effect  stay safe everyone ,1,14,3,1,6.428571428571429,103,9
erdogan s bloody gambit  on july 20 a suicide bombing in turkey took the lives of 31 socialists in surui,1,21,6,1,5.761904761904762,141,8
how do people bake without turning their kitchen into a war zone of eggs and flour,0,16,7,0,4.1875,82,0
seriously do we have to do a tactical riot against the headquarters of disney and marvel ,0,16,10,0,4.75,91,3
c 130 specially modified to land in a stadium and rescue hostages in iran in 1980,1,19,6,1,5.631578947368421,126,9
displaced at point of no return  like conditions ihhen msf refugees,1,17,4,1,6.941176470588236,136,10
long road to ruin   foo fighters,0,7,1,0,3.7142857142857135,32,1
watching xela firefighters struggle to save burning buildings last night w  old equipment makes me so grateful for dcfd,1,21,4,0,5.523809523809524,136,3
condemnation clearly replacing the latest response aimlessly dryer evacuate detersion de  hlg,1,12,1,0,6.833333333333333,93,1
must get hot in burning buildings  loses followers ,1,9,2,1,7.444444444444445,76,7
arrest report  affiliation with terrorism,1,6,1,0,8.0,53,2
fuck sake john jesus my heart just sunk ,1,9,2,0,5.0,53,2
families to sue over legionnaires  more than 40 families affected by the fatal outbreak of legionnaires  disea ,1,18,7,1,6.611111111111111,136,10
really needs to tone it down some in the weight room  rt   demolition  cont ,0,17,6,1,6.352941176470588,124,11
like a beautiful ass tragedy lol,1,7,2,0,6.142857142857143,49,2
m 1 4   4km e of interlaken california  time2015 08 06 00 52 25 utc2015 08 05 17 52 25  07 ,1,16,1,1,7.5,135,22
ambulance sprinter automatic frontline vehicle choice of 14 lez compliant   ebay,0,13,1,1,7.0,103,6
if that would of been a black dude antioch would be rioting,0,12,8,0,4.0,59,0
national free root beer float day is tomorrow at a amp w from 2pm close  help support the wounded warrior project with donations   ,0,21,5,0,5.428571428571429,134,9
these wild fires out west are crazy ,1,7,3,0,4.285714285714286,36,1
couples having less sex  for fear it ll be a let down  internet movies and books saying how sex  ought to be  pu ,0,23,7,1,5.086956521739131,139,13
draw day demolition daily football selection service that consistently makes money lay you ,0,15,1,2,8.266666666666667,138,11
men escape car engulfed in flames in parley s canyon crews investigating cause  ,1,15,2,2,7.466666666666667,126,12
llf talk world news u s  in record hurricane drought   the united states hasn t been hit by a major hurricane in  ,1,23,7,1,5.086956521739131,140,12
the twins pitcher s ego is now wrecked,0,7,2,0,4.571428571428571,38,1
he came to a land which was engulfed in tribal war and turned it into a land of peace i e  madinah ,0,23,11,0,4.391304347826087,123,5
body bagging mfs,1,4,0,0,5.5,25,1
my lil brother has a crush on mariah  ,0,9,4,0,3.888888888888889,43,6
sooo police dispatch said there was a person threatening to shoot up the walmart on rutherford  amp  they had to evacuate,1,21,10,0,4.809523809523809,121,2
charred remains of homes on 2nd st in manchester nh after fire rips through 2 buildings damaging neighboring homes,1,20,5,1,5.9,137,5
sydney hostage crisis has now been recovered from the airasia wreckage ,1,11,4,0,5.545454545454546,71,1
womens satchel lattice chain studded cross body multi colour shoulder bags blue,0,14,0,2,8.0,125,10
still blazing  ,0,3,0,0,5.333333333333333,18,4
 kinda screamed  gt lt ,0,4,0,1,11.75,50,12
california oil spill might be larger than projected ,1,10,2,2,8.9,98,11
i blew up snapchat for no reason  ,0,8,4,0,3.5,35,2
isil claims suicide bombing at saudi mosque that killed at least 15,1,14,3,2,7.142857142857143,113,10
city implores motorists not to speed after more reports of animal fatalities near nature reserves  gt ,1,17,5,1,6.470588235294118,126,8
sammy and todd always to the rescue may not be in uniform but still to the rescue lmao  forever kfc fam ,0,21,9,0,4.0,104,2
just cos germany invaded poland japan bombed pearl harbor pre emptive suicide,1,14,1,1,7.571428571428571,119,8
70 years after atomic bombs japan still struggles with war past  the anniversary of the devastation wrought b ,1,19,5,1,6.157894736842105,135,9
you cunt,0,4,1,0,7.75,34,3
heat wave gotta be over 9000 today,1,7,2,0,4.0,34,0
ever since my facebook meltdown after the padres fiasco  mets are 6 0  you re welcome,0,15,7,0,5.133333333333334,91,5
massive sinkhole emerges in brooklyn,1,7,1,2,10.857142857142858,82,10
oops  bounty hunters try to raid phoenix police chief s home     a group of armed bounty ,1,18,3,2,6.666666666666667,137,18
133 n past the 5 l lane is reopened  all other lanes are closed  all lanes are open on the 133 s  trash truck fire cleanup ,1,27,9,0,3.925925925925926,133,5
i m gunning down romance it never did a thing for me but heartache and misery ain t nothing but a tragedy,0,21,11,1,5.142857142857143,128,7
 with the screeching siren accompanying it just before he walked out ,0,12,5,0,5.833333333333333,81,3
escaping her captors was the 1st step  now she must survive a deadly storm  amp  a wild looking recluse  betrayed,1,21,6,1,5.857142857142857,143,11
hm mt   alabama home quarantined over possible ebola case,1,12,1,2,8.666666666666666,115,12
there s this person  amp  they reckon when you re dying your brain floods with dmt causing you to relive your life in real time in a simulation,0,26,13,0,4.538461538461538,143,4
 three were when a severe in the caused a  ,1,16,6,1,6.4375,118,13
tv  vitaly churkin briliantly exposes the hypocrisy of the ukraine s fm klimkin about the mh17 disaster,1,17,5,1,6.470588235294118,126,7
i cant believe is this d same stuart broad who was destroyed by our yuvi ,0,16,7,0,6.0,111,12
firepower in the lab  electronic resource    automation in the fight against infectious diseases and bioterrorism  u ,0,18,6,1,6.888888888888889,141,10
solano sr37   skaggs island rd  trfc collision 1141 enrt ,1,10,0,1,7.3,82,11
winnipeg police seek witnesses in arlington and william fatal crash,1,11,2,1,7.272727272727272,90,5
vinnie jones goes on the beat with northumbria police,0,10,3,1,6.7,76,5
dad bought a dvd that looks like a science doc on the front but i read the back and it s actually about the impending biblical apocalypse,1,26,13,0,4.307692307692308,137,1
air group is here to the rescue  we have 24 7 emergency service  learn more about it here  ,0,20,10,2,5.9,137,14
cultivating joy in the face of catastrophe and suffering,0,13,4,2,8.461538461538462,122,13
the last few days of summer are supposed to be the most fun so what s more fun then accidentally burning arm hair while playing w  a lighter,0,27,14,0,4.222222222222222,140,2
flat footballs  more like he flattened the spartans from crushing them back in the day ,0,17,8,0,5.823529411764706,115,10
  dubstep hardstyle trap messy mix  event recording  by alien casualty on,1,15,2,2,8.266666666666667,138,15
disregard my snap story there is an angry white girl riot happening as we speak ,1,16,6,0,4.6875,90,2
they all are intending to go  just waiting for winds to drop  siren just gone off to signal they allowed to leave arena none gone,1,25,12,0,4.64,140,4
bloomberg will publish anything negative to try and derail public support in favor of the  ,0,17,5,0,5.176470588235294,104,3
refugio oil spill may have been costlier bigger than projected   ,1,13,3,2,7.615384615384615,111,11
oh shit its rly sheeting aaaaaand there s the thunder and lightning i missed summer storms,1,15,5,0,5.066666666666666,90,1
governor allows parole for california school bus hijacker  local ,1,11,1,2,9.363636363636363,113,14
9000 photographs from 1800 s british mandate of palestine   with no trace of  palestinians ,1,15,5,1,6.666666666666667,114,9
much of which has to do with lebanon 80s attack  iran hostage crisis  libya pan am,1,20,7,0,5.9,137,8
bomb crash loot riot emergency pipe bomb nuclear chemical spill gas ricin leak violence drugs cartel cocaine marijuana heroine kidnap bust,1,21,0,0,5.619047619047619,138,0
i fell off someone s back and hit my head on concrete   i was bleeding n shit,0,18,7,0,4.055555555555555,90,4
hail the new caesars ,0,6,1,2,10.333333333333334,67,11
cameroon repatriated 12000 nigerian refugees,1,6,0,1,10.333333333333334,67,5
throw that water at me until i drown and my last words are choke me,0,16,9,1,4.6875,90,5
  16yr old pkk suicide bomber who detonated bomb in    bestnaijamade bestnaijamade bestnaijamade beu ,1,16,2,1,7.8125,140,11
jay big l pun biggie wrap over zero question fatality flawless victory,0,7,0,1,16.857142857142858,124,31
katunews  remains closed as brush fire burns 1700 acres ,1,13,1,2,8.153846153846153,118,14
do you want to play a game   its a googlemaps mashup that calculates the effects of the detonation of nuclear bomb,0,22,11,1,5.227272727272728,136,6
the latest  more homes razed by northern california wildfire   abc news,1,13,3,1,6.307692307692308,94,7
u s national park services tonto national forest  stop the annihilation of the salt river wild horse   via,0,19,3,1,6.368421052631579,139,11
 to luka  they should all die  all of them  everything annihilated    alois trancy,0,14,5,0,4.928571428571429,82,6
success is not permanent  amp  failure is not fatal ,0,9,4,0,4.888888888888889,52,3
 s tax revenues collapse as debt crisis continues via   mp,1,13,1,1,7.230769230769231,106,10
so these savages leaked thomas brady gangstermail account and wonder why he was quick to fatality his samsung mobile  b real son ,0,22,8,0,4.909090909090909,129,2
this is the natural and unavoidable consequence of socialism everywhere it has been tried   a,1,16,9,1,6.25,115,6
hellfire  we donut even want to think about it or mention it so letus not do anything that leads to it ,0,21,11,0,4.142857142857143,107,2
flood and mudslide warning for east fjords   iceland review  via,1,14,2,1,7.428571428571429,117,9
m 1 4   4km e of interlaken california  time2015 08 06 00 52 25 utc2015 08 05 17 52 25  07 00 at ep ,0,18,2,1,6.555555555555555,135,23
fel lord zakuun is about to die  ,1,11,3,1,5.545454545454546,71,8
for those impacted by the here are some great recovery tips to help you in the aftermath,1,19,11,1,5.631578947368421,125,6
i just screamed to the world how much i love my little pony  ,0,15,7,0,4.266666666666667,78,3
  police had previously died in a road accident they were not killed by explosion,1,17,7,1,6.352941176470588,124,8
on 1st august jets bombed the village zergele in qendil and killed 8 civilians and 15 others wounded,1,19,5,0,4.789473684210527,109,1
late night mcdonalds with friends   hilarious although my car is wrecked and there s half a steak pastie in the industrial estate,0,22,8,0,4.909090909090909,129,2
2015 new fashion ladies gold watch waterproof weiqin famous brand michel quartz de lujo cau ,0,17,0,2,7.235294117647059,139,11
video   we re picking up bodies from water  rescuers are searching for hundreds of migrants in the mediterranean after a boat carryi ,1,21,9,0,5.523809523809524,136,8
love my girlfriend,0,3,1,0,5.333333333333333,18,0
i made a friend more interesting than all of y all combined,0,12,6,1,6.0,83,6
madhya pradesh train derailment  village youth saved many lives  a group of villagers saved over 70 passengers  lives after two train ,1,21,4,0,5.523809523809524,136,6
uribe demolished that ball  ,0,5,1,0,5.8,33,6
hurricane guillermo live noaa tracking   looping wed aug 5th     ,1,13,0,3,9.307692307692308,134,20
more like coffee and noodles burned,0,7,3,0,6.285714285714286,52,2
ay i am fully panicking lol,0,6,2,0,3.6666666666666665,27,0
i scored 111020 points in punch quest stopped when a squeaky bat collided into my skull ,1,17,6,1,5.588235294117647,111,6
fedex no longer shipping bioterror germs   wxia tv  ,0,11,1,1,6.727272727272728,84,9
refugio oil spill may have been costlier bigger than projected,1,13,3,1,6.6923076923076925,99,7
such beautiful architecture in i love those fire escape routes on the buildings ,1,16,6,1,6.625,121,9
and flattened raynor  raynor was a balding imperfect biker marine not a emo generic western hero ,0,19,5,0,6.0,133,5
ignition knock  detonation  sensor connector connecto motorcraft wpt 410,0,9,0,2,12.22222222222222,118,14
i m in utter shock and devastation you don t go to work to be left feeling how i do now  life really is too short  ,1,25,13,0,3.68,116,5
i love you bb,0,5,2,0,4.6,27,1
1 9 earthquake occurred 15km e of anchorage alaska at 00 11 utc ,1,14,2,1,6.928571428571429,110,10
watch this airport get swallowed up by a sandstorm in under a minute,1,14,8,1,5.571428571428571,91,5
check this udhampur terror attack  militants attack police post 2 spos injured u ,1,16,1,1,7.3125,132,11
map shows where all of california s wild are burning  this map created by cal fireu ,1,17,6,2,7.117647058823529,137,14
catastrophic fallen angel  reveillertm  macabrelolita  i was supposed to write uamino acidsu and i nearly ,0,14,5,1,8.714285714285714,135,13
you said it s rude based on an experience  kind of a next level sub tweet in a way lol  either way you got worked up,0,26,10,0,4.038461538461538,130,5
first tweet collided with a selfie  pretty  sweet  if you ask me ,0,13,4,1,6.076923076923077,91,12
this is a one direction concert not a war zone what is this,1,15,8,1,5.4,95,6
is giving me vibe  music teacher looks out for students has crush on girl he went to high school with   ,0,23,8,0,5.0,137,6
families to sue over legionnaires  more than 40 families affected by the fatal outbreak of legionnaires  disea ,1,18,7,1,6.611111111111111,136,10
rt rabidmonkeys1  ah the unique mudslide cake  ,0,9,1,1,7.555555555555555,77,9
when they die they just get teleported into somewhere middle of ocean and stays trapped in there unless they decides 2 6,0,22,11,0,5.2727272727272725,137,2
bad day,0,2,0,0,3.0,7,0
earthquake   m 3 4   96km n of brenas puerto rico  time2015 08 05 10 34 24 utc2015 08 05 06 34 24  04 00 atu ,1,18,1,1,6.444444444444445,133,20
that horrible sinking feeling when youuve been at home on your phone for a while and you realise its been on 3g this whole time,1,25,15,0,4.2,129,0
baltimore city   i 95 north at mp 54 8  fort mchenry tunnel bore 3  collision  i 95 north at mp 54 8  fort mchenry tunnel bore 3 nort ,1,25,2,0,4.48,136,12
has entered into the project to replace and hellfire missiles  check it out here ,0,18,7,1,5.888888888888889,123,10
 bloody  ell  let it burn ,0,6,1,0,5.166666666666667,36,6
rt abbswinston  demolish 18 structures in jordan valley  u ,1,14,1,2,8.928571428571429,138,15
via hundreds feared drowned as migrant boat capsizes off libya,1,13,2,1,7.846153846153846,114,8
the blazing elwoods   don t bother me  doug s song   tune,0,12,3,1,7.083333333333333,96,12
ford truck starts up and drives off after being destroyed by tornado ,1,13,6,1,6.153846153846154,92,6
twitter is just here to destroy your childhood,0,8,5,0,4.875,46,0
bitches be takin pics with bags bigger than they whole body  ,0,12,4,0,4.583333333333333,66,6
8th person dies in ny legionnaires  disease outbreak,1,10,1,1,7.3,82,7
the  barbaric saudies  as you said they relive austrian economy  if we stop coming here many project will collapse ,0,20,7,0,5.4,127,5
happening now   hatzolah ems ambulance responding with dual sirens andu ,0,12,1,1,7.166666666666667,97,7
shot through the heart xv  you are going to totally give love a bad name with this heart pierc,0,21,8,2,5.714285714285714,140,11
no passengers were on the derailed train  but the who morning commute is fcked  go home ,1,17,8,0,5.117647058823529,103,4
weather warfare follow the money this government is what our founding fathers were warning us about the weather ,1,19,8,1,6.2631578947368425,137,8
slayer reflects on low mayhem festival attendance king diamond  amp  jeff hanneman s passing,0,14,1,1,7.285714285714286,115,8
bbc forced to retract false claims about cyclone pam  via,1,12,2,1,7.083333333333333,96,6
rt   documenting climate change s first major casualty  via,1,11,0,1,8.909090909090908,108,9
the average gop voter would go to a big tent circus in a hailstorm windstorm no   ,0,16,6,0,5.0,95,7
  pic of 16yr old pkk suicide bomber who detonated bomb in turkey army trench released   ,1,18,3,1,5.722222222222222,120,16
wonder how much the upheaval with team is affecting different players tonight ,0,13,4,0,5.6923076923076925,86,2
watch this airport get swallowed up by a sandstorm in under a minute,1,14,8,1,5.571428571428571,91,5
suicide bomber kills 15 in saudi security site mosque,1,11,1,1,6.909090909090909,86,6
police officer wounded suspect dead after exchanging shots  ushed,1,11,1,1,7.818181818181818,96,6
yea so i m gonna demolish all those boundaries that i seem to have  unconsciously  set for myself with negative thoughts ,0,20,11,0,5.1,121,4
reddit will now quarantine offensive content,0,9,0,1,8.444444444444445,84,7
hurricane guillermo live noaa tracking   looping wed aug 5th     ,1,13,0,3,9.307692307692308,134,20
the latest  more homes razed by northern california wildfire   abc news,1,13,3,1,6.307692307692308,94,7
some jewish ppl agree tht israel is a bully nd a terrorist state killin palestine kids nd women,1,21,4,0,5.714285714285714,140,3
nah but thinking of getting a stretcher in my foreskin what u think ,0,14,6,0,4.785714285714286,80,2
i m glad you got away xd but my  be safe  was in reference to a tornado near calgary and drum heller at around 4  o,1,26,10,0,3.923076923076923,127,5
watching a man electrocuted on the roof of is definitely a lesson  people please learn ,1,19,6,0,6.368421052631579,139,8
wreckage  conclusively confirmed  as from mh370  malaysia pm  investigators and the families of those who were ,1,17,7,1,7.0588235294117645,136,12
treasures revealed as california drought drains lakes,1,8,1,1,8.625,76,5
does anyone know why was evacuated this evening ,1,11,4,0,6.363636363636363,80,5
six people were killed thursday when a taliban suicide bomber detonated an explosives rigged truck outside a police compound in eastern,1,20,6,0,5.8,135,1
is the update rly life now is it is it screams vibrates i cant handle,0,14,6,0,4.0,70,1
if there s a chance will get a gander of the sinking ship that is too  can t help but appease my morbid curiosity ,0,24,12,0,4.791666666666667,138,6
i forgot to add the burning buildings and screaming babies,1,11,4,0,5.363636363636363,69,1
large fire burning several buildings causing evacuations in downtown hinton ,1,11,1,1,8.090909090909092,99,6
obama declares disaster for typhoon devastated saipan  obama signs disaster declaration for northern marians a ,1,15,2,1,8.133333333333333,136,10
when you lowkey already know you re gonna drown in school this year  ,0,14,5,1,5.714285714285714,93,8
sadly before she could save humanity ursula drowned in the drool of a protoshoggoth but at least she sort of died doing what she loved ,1,25,14,0,4.44,135,1
i accidentally killed an 87 day snap streak and now i wanna accidentally fall off a cliff  ,1,18,6,0,5.166666666666667,110,20
16yr old boy pic pkk suicide bomber who detonated bomb in turkey army trench,1,16,2,2,6.6875,122,10
16yr old pkk suicide bomber who detonated bomb in turkey army trench released,1,14,2,1,6.214285714285714,100,5
womanus gps app guides rescuers to injured biker in marin county,1,12,2,1,6.5,89,5
 the way you move is like a full on rainstorm and i m a house of cards ,1,16,9,0,3.5,71,3
drew storen is probably curing cancer  amp  saving puppies from burning buildings while contemplating what he did 2 deserve this disrespect,0,21,7,0,5.666666666666667,139,2
forest fires  amp  dying salmon  time 2 act not deny  climate change nightmares are here,1,19,3,1,6.2631578947368425,138,12
how american war planners singled out hiroshima for destruction,1,10,3,1,7.7,86,5
