text,target,word_count,stop_word_count,url_count,mean_word_length,char_count,punctuation_count
plane debris discovered on reunion island belongs to flight mh370 uo malaysian pm,1,14,2,1,6.571428571428571,105,5
you just got gif bombed,0,8,2,1,8.125,73,7
tell to rescind medals of  honor  given to us soldiers at the massacre of wounded knee  sign now  amp  rt ,1,22,6,1,5.545454545454546,143,12
breaking  obama officials gave muslim terrorist the weapon used in texas attack,1,13,2,1,6.923076923076923,102,6
suicide bomber targets saudi mosque at least 13 dead   suicide bomber targets saudi mosque at least 13 dead this is ridiculous,1,23,4,0,5.043478260869565,138,3
  warfighting robots could reduce civilian casualties so calling for a ban now is premature   ieee spectrum,1,19,5,1,5.947368421052632,131,8
national briefing   west  california  spring oil spill estimate grows  documents released on wednesday d    nyt ,1,17,1,1,7.0588235294117645,136,14
haha  are you really comparing yourselves to the emergency services  thats brilliant  talk about up your own arse ,0,20,8,0,6.15,142,13
there s still room for you at our party for first responders from around the country  3rd annual best ever ,0,20,8,1,5.55,130,8
smokers that ruin that new car smell  ,0,8,2,0,4.25,41,4
did the first world war ever truly end  the ripples are with still and have been compound into low level tsunami,1,22,10,0,4.454545454545454,119,2
hello wud u kindly consider following me bak please i m never any trouble lol many thanks  ,0,18,3,0,5.0,107,5
the president spoke of kennedy s diplomacy to avert nuclear disaster during the cold war to bolster his own pitch for congress  approval,1,22,9,0,5.227272727272728,136,2
100 1  mix new flat double sided linerless bottle caps you choose mix flattened   full reu ,0,19,1,2,6.315789473684211,139,13
man crush everyday  ,0,6,0,1,9.666666666666666,64,10
  is serving more than 75k veterans  52k oif oef vets have physical wounds  many more have invisible ones,1,20,6,1,6.05,140,11
heat wave in wb heavy losses and no compensations  report      via palinfoen ,1,15,3,1,6.4,113,11
migrating from iphoto to photo is a catastrophe  i have wasted days trying to get this to work  12 hrsto get to 8  complete ,0,25,12,0,4.6,139,5
well said sir  my cousin was a pow  brutally treated  survived but never talked about it  the bombing was justified,1,21,7,1,5.666666666666667,139,9
 we can help  says denver firefighter working to curb first responder suicide,1,13,2,1,6.769230769230769,100,7
if you sit and rant on snapchat to your apparent fans when you have about 8000 followers i hope your in a train crash xoxo,0,25,14,0,3.92,122,0
did anyone else see that fireball falling to earth  look like a plane blew up ,1,15,6,0,4.266666666666667,78,2
 redskins wr roberts belly bombed   via,1,8,0,1,8.375,74,9
junko was 13 years old when the atomic bomb exploded over on august 6 1945 ,1,18,5,2,6.388888888888889,132,12
fb page of bushman safari s zimbabwe the company that palmer used 2 kill cecil is inundated with negative commentes,0,20,5,1,6.0,139,6
4sake of argsuppose pre born has attained individl rights generally courtof law forbids killing unless dead person did something,0,18,3,0,6.777777777777778,139,3
next may i ll be free from school from obligations like family  best of all that damn curfew ,1,16,7,0,5.3125,100,11
trauma can happen anywhere   school home etc    at any time  learn the abc s of trauma and how to parent  u ,1,23,8,1,4.956521739130435,136,16
u s national park services tonto national forest  stop the annihilation of the salt river wild horse   via,0,19,3,1,6.368421052631579,139,11
uribe just annihilated that baseball ,0,6,2,0,6.333333333333333,43,2
i hope you drown  ,0,6,2,0,5.166666666666667,36,3
this week has been a whirlwind but this is exactly what i imagined the nyc version of my career to be like,0,22,15,0,3.863636363636364,107,0
mmmmmm i m burning  i m burning buildings i m building  oooooohhhh oooh ooh ,0,11,3,0,6.727272727272728,84,14
burning buildings  media outrage ,1,5,0,1,10.4,56,7
former township fire truck being used in philippines   langley times,1,13,2,1,7.076923076923077,104,7
i just saw these tweets and i feel really attacked,0,12,5,0,5.75,80,3
i m tryna smoke that mf out,0,7,3,0,5.0,41,2
haunting memories drawn by survivors,1,6,1,1,9.0,59,5
neither of them even smoke so i dk what was going on lol,0,14,7,0,3.928571428571429,68,2
causes in gilgit damage to 20 homes farmland roads and bridges,1,16,3,1,7.3125,133,9
rainstorm destroys 600 houses in yobe state,1,8,1,1,7.375,66,5
good tips  does your family have an emergency plan   ,0,12,4,2,7.5,102,15
i want it to rainstorm please,0,6,3,0,4.0,29,0
descriptions of  wounded cats being  exciting ,0,7,2,1,9.0,69,8
clev  me    you  clev  indeed    do you know what happened to ben  clev  he drowned    how  clev  by his father ,0,24,7,0,4.166666666666667,123,15
not a catastrophe at all i m perfectly content  being the only one means nothing when i m being controlled  text me if you got crap to say,0,26,15,0,4.346153846153846,138,4
what a fucking idiot  he had a gun  amp  a hatchet yet there were still no serious injuries  glad police terminated him ,1,23,9,0,4.565217391304348,127,6
quality metrics penalties may harm patient care pcps say  primary care physicians generally hold positive vi ,0,17,0,1,6.941176470588236,134,9
firefigthers evacuate from northampton township house fire,1,8,1,1,9.25,81,5
y all read 12000 nigerian refugees repatriated from cameroon,1,9,1,1,8.333333333333334,83,6
this friday  palm beach county series one night screening of,0,14,2,1,8.571428571428571,134,10
when fizzy is sitting in the regular flood seats   and no one knows who she is ,0,17,8,0,4.235294117647059,88,11
billionaires have a plan to free half a billion dollars trapped in venezuela for two years reports ,0,19,6,1,6.2105263157894735,137,7
i can see why one of your favorite books is  beautiful disaster  it may now be one of mine ,0,20,9,0,4.5,109,5
politifiact  harry reid s  30 percent of women served  planned parenthood claim is a  pants on fire  lie ,0,19,4,1,6.2105263157894735,136,15
i m feeling so attacked,0,5,2,1,8.6,47,6
police investigating after an e bike collided with a car in little portugal  e bike rider suffered serious non life threatening injuries ,1,19,5,0,6.2631578947368425,137,5
looking for a injury solicitor,0,10,2,2,9.8,107,13
i hope he does  and i hope you die in the explosion too,1,14,8,0,4.142857142857143,71,2
bioterrorism public health superbug biolabs epidemics biosurveillance outbreaks   homeland security news wire,1,14,0,1,8.5,132,6
putin s plan to destroy western food en masse is causing a huge public backlash,0,15,3,1,5.866666666666666,102,6
so others don t get burned,0,6,3,0,5.666666666666667,39,3
las vegas in top 5 cities for red light running fatalities,1,11,2,1,6.454545454545454,81,6
sustainability task force presents levy to fund emergency services   wdtv,1,12,1,1,7.083333333333333,96,6
so did we have a hurricane tornado tsunami  someone please tell me what the hell happened,1,17,8,0,4.823529411764706,98,2
mrw when a sinkhole opens up beneath my friends and i ,1,20,5,1,5.55,130,16
i d like to think i m photogenic but every time i see a pic with me in it i just think to myself  gosh what a disaster  xd,0,27,17,0,3.555555555555556,122,4
sinjar massacre yazidis blast lack of action over hostages,1,10,2,1,7.2,81,5
porcupine tree   drown with me  live  at,0,12,3,1,6.5,89,11
pov footage captures violent landing from inside plane during storm,1,11,2,1,7.272727272727272,90,5
in 2014 i will only smoke crqck if i becyme a mayor  this includes foursquare ,0,15,7,0,4.266666666666667,78,2
if i press on the twitch will my head explode ,0,11,5,0,4.2727272727272725,57,2
mama i m still thuggin the world is a war zone my homies is inmate and most of em dead wrong ,0,20,9,0,3.7,93,2
wen i finally get the girl i want i m flooding yall wit all pics of us rs tho,0,18,7,0,3.333333333333333,77,1
beyonce is my pick for  fan army  72,0,11,3,2,7.181818181818182,89,11
horrible accident man died in wings of airplane  29 07 2015 ,1,10,2,1,7.4,84,9
wrecked emotions ,0,2,0,0,8.0,17,1
listen to landslide by oh wonder,0,8,2,1,7.625,68,6
i be seen them turn a blind eye to a bloke drinking and smoking on during the curfew time cos its not worth the hassle ,1,25,12,0,4.2,129,3
fears over missing migrants in med  rescuers search for survivors after a boat carrying as many as 600 migrantsu ,1,20,7,1,5.9,137,7
incredible  the children were screaming buildings were burning and i was dancing in the ashes,1,16,8,0,5.9375,110,3
hmm this could be problem for some researchers  fedex no longer to transport select agents  via,1,17,6,1,6.647058823529412,129,10
don t get burned twice by the same flame ,0,8,5,0,4.25,41,2
see aug 4 2015 poconorecord   how many households have an plan   ,1,17,3,2,7.235294117647059,139,15
suicide bomber kills 13 at saudi mosque,1,11,1,1,6.818181818181818,85,8
suicide bomber kills 15 in saudi security site mosque   reuters canada  reuters canadasuicide bomber kills 15  ,1,19,1,1,6.2105263157894735,136,10
on thursday at 00 25 we updated our of 2d and 3d exploration vessels ,0,18,6,1,5.777777777777778,121,11
setting things on fire is always an option,1,8,3,0,4.375,42,0
want to work in ca  view our latest opening ,0,15,3,1,6.0,104,12
 california is burning  gov  jerry brown told reporters at a press conference that california is experiencing ,1,17,5,1,7.0588235294117645,136,12
they didn t succeed the other two times either  bomb didn t detonate amp shots missed ,1,16,5,0,8.0,143,10
i couldn t ,1,4,1,0,7.75,34,4
i still don t see the point of a frozen sequel like where s the wreck it ralph sequel,0,17,9,0,4.0588235294117645,85,2
sleeping with sirens vai vir pra sp,0,7,1,0,4.142857142857143,35,0
some people are really natural disaster too,1,7,3,0,5.285714285714286,43,0
what a win by kerry  7 16 ,0,7,3,0,5.428571428571429,44,8
fylde building set to be flattened  one of prestonus city centre iconic buildings is disappearing from the skyline ,0,19,6,1,6.421052631578948,140,7
yes i love it,0,5,2,0,3.6,22,1
 by replacing fear of the unknown with curiosity we open ourselves up tou ,0,14,6,1,6.142857142857143,99,7
 er indoors will be devastated  rip arfur ,1,8,1,0,5.875,54,4
panicking because maybe my bff left me at china bar or maybe tindering on the toilet for 20mins,0,18,8,0,4.333333333333333,95,0
 1 million bail for man accused of at fife   aug 5   8 16 pm et,1,19,3,1,4.526315789473684,104,11
share large sinkhole swallows entire pond in lowndes county georgia a largeu ,1,14,2,1,6.857142857142857,109,7
south sac florin rd   franklin blvd  trfc collision 1141 enrt ,1,11,0,1,7.0,87,11
5 15p for those who watch over me forest fire smoke has lifted  nuff f me t make a run t the pet store on the hwy  n  i ll b home by 7p ,1,28,11,0,3.928571428571429,137,11
did josephus get it wrong about antiochus epiphanes and the abomination of desolation  read more ,0,16,7,1,6.5625,120,7
large sinkhole swallows entire pond in lowndes county georgia  large sinkholeu ,1,13,1,1,7.923076923076923,115,8
coastal german shepherd rescue oc shared a link    ,0,12,1,2,8.5,113,15
if i may ask cyclone sama have you read jailed fate by rindou ,0,13,5,0,5.076923076923077,78,4
screams  where is everyone  oh wait school ok im ok,0,10,2,0,4.2,54,2
bring back games from the past  snowstorm  tic tac toe  battleships  fast food  matchwood ,1,15,2,0,5.533333333333333,97,7
correction  tent collapse story  roh3 smantibatam,0,13,0,1,9.0,129,12
peel police say male cyclist struck near southdown road and royal windsor drive in mississauga  serious but non life threatening injuries ,1,20,3,0,5.95,138,3
standard damage control,1,4,0,0,9.0,39,1
what is one fantasy work about a diverse heroine that you think everyone should read ,0,17,7,1,6.529411764705882,127,7
obsolete devastation from broad with the ball  and root doing it with bat in hand  great day,0,20,8,1,5.8,135,9
  the hobbit  the desolation of smaug  bilingual ,0,9,3,1,7.333333333333333,74,10
u s national park services tonto national forest  stop the annihilation of the salt river wild horse   via,1,19,3,1,6.368421052631579,139,11
dakota skye gets horny with some porn then gets her juicy pussy pounded  view and download video,0,18,5,1,5.611111111111111,118,5
emergency shutdown systems   edmonton,1,6,0,1,9.166666666666666,60,6
i m so traumatised ,0,3,2,0,5.666666666666667,19,2
bin laden family plane crashed after  avoiding microlight and landing too far down runway  three members  ,1,19,4,1,6.2105263157894735,136,12
tarp is protecting outfield and cannot be moved  infield getting deluged ,1,11,4,0,5.727272727272728,73,2
picking up a man in a bar is like a snowstorm you never know when he s coming how many inches you ll get or how long ll he ll stay ,0,27,16,0,3.888888888888889,131,5
going clay pigeon shooting and crying because of the  aftershock ,0,11,4,0,6.636363636363637,83,3
uk police link tunisian beach massacre with bardo museum attack,1,11,1,1,6.909090909090909,86,5
the way he did me destroyed me ,0,7,4,0,3.857142857142857,34,3
the windstorm blew thru my open window and now my bong is in pieces just another example of nature s indifference to human suffering,0,23,9,0,4.782608695652174,132,1
businesses are deluged with invoices  make yours stand out with colour or shape and it s likely to rise to the top of t e pay  pileq,1,26,12,0,4.115384615384615,132,3
ogun smugglers engage customs in shootoutae  several persons were allegedly injured on wednesday when men o ,1,18,4,1,6.666666666666667,137,10
flood  two people dead 60 houses destroyed in kaduna  two people have been reportedly killed and 60 houses ut ,1,20,4,1,5.8,135,10
summer,0,11,0,1,9.363636363636363,113,14
  obama declares disaster for typhoon devastated saipan  obama signs disaster declaration for northern ma   ,1,15,2,0,8.133333333333333,137,11
check out this preview of danger zone coming soon ,0,15,3,1,8.4,140,11
her cake looks like a mudslide hah,0,7,3,0,4.0,34,0
this is interesting why did god order obliteration of ancient canaanites   via,0,13,4,1,8.076923076923077,117,10
but if it s the apocalypse lol gf m8,0,8,4,0,3.625,36,1
schools in western uganda still burning down buildings during strikes strikes in western uganda always lit literally ,1,16,4,0,6.625,121,6
i m seeing them and issues at aftershock  ,0,9,4,0,5.111111111111111,54,4
enugu government to demolish illegal structures at international conference centre  enugu state government app ,0,15,2,1,8.133333333333333,136,9
large explosion rocks aluminum plant in southeast missouri re naomi no logo,1,11,1,1,8.0,98,7
families to sue over legionnaires  more than 40 families affected by the fatal outbreak of legionnaires  disea ,1,18,7,1,6.611111111111111,136,10
i hate that im so awkward and i ruin things,0,10,5,0,3.4,43,0
louis in red jacket round 2 aka drowning in my tears,0,11,3,0,3.8181818181818175,52,0
and all you girls that smoke  have you notice that you started to lose alot of weight   hmmm don t know body want no thin girl tf,0,27,12,0,4.0,134,8
11 30a radar update  widespread showers storms but moving over the same areas minor flooding possible,1,15,4,1,7.8,131,10
2 deaths from measles complications in 10 yrs everyone looses their shit  8 dead from legionnaires in a month  amp  crickets,1,22,6,0,5.5,142,4
destroy the free fandom honestly,1,5,1,0,5.6,32,0
probably  we are inundated with them most years ,0,9,5,0,5.555555555555555,58,4
gop debate drinking game  for anyone looking for a bit of fun while watching this train wreck ,0,19,6,2,6.421052631578948,140,12
the fifth pre dynastic in the legendary period before the   the shepherd ,0,15,5,1,7.133333333333334,121,13
 i tried to save mido macia  one of the murder accused has testified he tried to save mido maciaus life ,0,21,6,1,5.238095238095238,130,9
i love fruits,0,3,1,0,3.6666666666666665,13,0
don t let your style fall flat this summer  lord  amp  cliff is your answer  adding this ,0,19,5,1,6.421052631578948,140,15
 no lender fees for veterans or first responders  past and present  on,0,14,4,1,6.571428571428571,105,10
the truth  i pulled a 16 out  and apparently a 22 in the crazy adult trauma  and they mocked me for the 22 ,0,25,12,0,4.6,139,6
rly tragedy in mp  some live to recount horror  timesofindia,1,13,3,1,6.846153846153846,101,8
editor in chief releases issue  of   and,0,15,3,1,7.466666666666667,126,13
sometimes you face difficulties not because you re doing something wrong but because you re doing something right    joel osteen,0,19,9,0,5.789473684210527,128,4
i got evacuated from the cinema 30 mins through inside out kill me please,0,14,6,0,4.285714285714286,73,0
they ll probably allow us to ascend them but not get them to the damage max values,0,18,9,0,4.944444444444445,106,3
something catastrophic is coming  should we tune out ,1,9,3,1,7.555555555555555,76,7
just bought another 18  medium crash  hey what about an endorsement  starting to get expensive ,0,17,6,0,6.352941176470588,124,7
fresh out da shower lookss    still loving this new hair does it ruin my brand ,0,18,5,1,5.166666666666667,110,11
nothing you midget i will demolish you show some respect,0,10,4,0,4.7,56,0
rail sends a message of condolence to vietnam following natural disaster,1,12,3,1,7.083333333333333,96,5
big data and social information explosion  the union that could evolve your retail strategy hua,0,14,5,0,6.0,97,4
70 years after atomic bombs japan still struggles with war past  the anniversary of the devastation wrought b ,1,19,5,1,6.157894736842105,135,9
shadow boxing the apocalypse,1,4,1,0,6.25,28,0
aunt marge you re blown up eheks,0,6,2,0,4.5,32,1
it wasnt a very big stab but it was a deep stab and theres like blood everwhe,1,17,9,0,3.588235294117647,77,0
so destruction it seems  i see myself ruined  somehow ,0,10,4,0,6.4,73,6
rt grant factory  weymouth meeting on seawalls and flood grants set for thursday night u ,1,17,3,1,6.588235294117647,128,10
nkea destroyed lives in gambia as a mercenary judge ,0,11,3,0,6.181818181818182,78,3
new mad max screenshots show off a lovely dust storm combat magnum opus,0,15,2,2,6.866666666666666,117,10
another fake hate crime lesbians burn their own house down  what else is new  ,1,15,5,1,5.733333333333333,100,7
photo  beach earrings beach jewelry vacation earrings keep calm and beach on earrings made with flattened ,0,17,3,1,6.764705882352941,131,9
remember that time patrick kane attacked a cab driver over  20,0,12,3,0,4.666666666666667,67,2
if you take the suit off him i wouldn t be surprised to hear this is the face that belonged to another democrat mass murderer,1,24,14,0,4.833333333333333,139,3
inws alert spsgsp from 8 5 2015 10 40 pm to 11 15 pm edt for pickens county  strong thunderstorm will impact ,1,19,3,1,6.105263157894737,134,13
rt   250k deaths per year from error   how to avoid being one of them ,1,18,5,2,7.0,143,16
if i can t ruin his mood then i may have lost my direction ,0,14,8,1,5.0,83,7
let s try to do our best to prevent another outbreak of violence by talking to each other both the people and the politics,1,24,14,0,4.708333333333333,136,2
now that a piece of wreckage from flight mh370 has been confirmed on riunion island is it possible t ,1,21,9,1,5.523809523809524,137,9
not only are you a mass murderer but at a movie theatre where niggas dropped bread to see a movie  cmon man ,0,22,11,0,3.954545454545455,108,2
never thought i could have that much fun saving  and shooting  teddy bear hostages  lol,0,19,4,0,5.947368421052632,131,8
youth electrocuted in khulna     via,1,9,1,2,9.333333333333334,93,12
what is the biggest regret you have in hearthstone ,0,10,6,1,6.5,74,6
rt   when you donut know how to do fatalities in mortal kombat,0,15,6,1,6.466666666666667,112,8
upheaval high note for bush opera,0,10,1,1,6.6,75,8
u s  in record hurricane drought,1,7,1,2,10.428571428571429,79,13
and he s the current nova in the bookslast i checked he was tied into the books in 2011 after rider died during annihilation,0,23,12,0,5.086956521739131,139,4
  ceo  divestitures and losses temper q2,0,10,1,1,8.9,98,10
plains all american pipeline company may have spilled 40 percent more crude oil than previously estimated ,1,17,4,1,6.823529411764706,132,9
its just now sinking in this is the last episode my heart hurts so bad,0,15,8,0,3.733333333333333,70,0
jacksonville busines fedex stops shipping potential bioterror pathogens,1,9,0,1,9.555555555555555,94,5
if you loved me even a little youd put demolition in bo3,0,13,5,0,4.6923076923076925,73,1
insane bush fires in california  be safe ,1,8,2,1,7.25,65,7
i think a lot of celebrities have to treat ppl as if they could harm them,0,17,10,0,4.0588235294117645,85,1
earthquake drill atm,1,3,0,0,6.0,20,0
family mourns drowning of  superhero  toddler with rare epilepsy   chicago tribune,1,14,2,2,8.214285714285714,128,13
udhampur terror attack  militants attack police post 2 spos injured,1,11,0,1,7.272727272727272,90,6
the latest  washington misses town  evacuations end   khq right now,1,13,1,1,6.769230769230769,100,9
 s displaced at point of no return  prison like conditionsprivation,1,14,3,2,9.0,139,15
tracy blight thank you for following me ,0,7,2,0,5.0,41,2
football is back this weekend its just sunk in  ,0,10,5,0,4.4,53,6
element of freedom  the biggest party of the summer   mirage saturday  tickets at,0,15,5,1,6.0,104,8
at in of  bioterror  manufactured fear and state repression ,1,16,4,1,7.6875,138,14
check this deal    sivan health and fitness basalt lava hot stone massage kit with 36 pieceu ,0,19,3,2,6.368421052631579,139,12
nothing to fear  it s all about taking risks ,1,8,4,0,4.75,45,3
wreckage  conclusively confirmed  as from mh370  malaysia pm  investigators and the families of those who were ,1,17,7,1,7.0588235294117645,136,12
follownflnews  michael floyd s hand injury shouldn t devalue his fantasy stock,0,14,2,1,7.785714285714286,122,11
i will adamantly opposed to nuclear weapons ,1,7,2,0,5.428571428571429,44,1
i feel like if mkayla and cee ever got in the same room everyone should evacuate because it would be so petty and childish i couldn t deal,1,27,17,0,4.148148148148148,138,1
lhh silent screaming was mastered,0,6,1,1,8.666666666666666,58,5
great job done by village hostages,1,7,1,0,6.285714285714286,50,1
that s beyond adorable  i hope it won t be wrecked now that it s been noticed  ,0,16,8,0,4.75,91,8
my grandfather was set to be in the first groups of marines to hit japan in operation olympic  95  casualty rate predictions,1,23,9,0,5.043478260869565,138,3
we allow farrakhan to to challenge 10000 males to rise up  amp  commit mass murder as he just did in miami ,1,23,10,1,5.217391304347826,143,9
stunningly poor defense it s not all on the pitcher  if our bats are mia like the top of 1st inning this team is in trouble ,0,26,14,0,4.115384615384615,132,4
update  i survived  no canoe  may have been the fastest feed out in history though ,1,15,7,0,4.6,85,4
cw500  dealing with disaster  ,1,6,1,1,8.0,53,7
have you been held hostage ,0,6,3,0,6.333333333333333,43,2
i want a full on bitch slapping guns blazing cake throwing charles showdown  now that will be worth the wait  ,0,23,6,0,5.086956521739131,139,8
see what happens with no battle of the block     finally,0,12,5,0,5.333333333333333,75,8
i added a video to a playlist  s 109   sws   fatality  captain falcon  vs  snow  fox  ssb4 losers,0,22,4,1,4.954545454545454,130,14
good luck to the   tomorrow night get some coefficient points plz  ,0,15,4,0,6.733333333333333,120,13
i liked a video  fema region iii targeted for bioterrorism   nasa   japan rocket launch with lithium,1,20,4,1,5.7,133,10
this sounds like a song you would hear in a movie where they are walking away from burning buildings and cars and shit,0,23,13,0,4.173913043478261,118,0
prince phillip said of the numbers of those murdered by the british at amritsar  uithatus a bit exaggerated it must include the woundedu ,1,23,10,0,5.304347826086956,145,4
mh370  aircraft debris found on la reunion is from missing malaysia airlines     abc online,1,17,3,1,5.882352941176471,116,10
that s one way to make their heads explode ,0,11,3,0,6.0,76,7
democrats restricted blacks from voting  in 48  landslide lyndon johnson won senate election by 67 votes of dead people in texas ,0,22,5,0,5.363636363636363,140,4
the crew on had nuclear bomb on board disarmed  15 mins to they got ready to arm little boy,1,22,7,1,5.181818181818182,135,8
crash in pascoe vale south outbound on tullamarine fwy  citylink  near moreland rd  vehicles off in emergency lane  no delays ,1,21,5,0,5.523809523809524,136,6
new boltaecyclone dr pp 400dr dual outlet power packaefor external camera flash  30u ,0,17,0,1,7.352941176470588,142,12
even staying up all night to he barrier for tiup and then having to run through a dust storm and almost passing out ,1,24,12,0,4.375,128,2
bomb squad set to detonate backpack antioch tenn  theater gunman had on him officials say  ,1,18,4,1,6.055555555555555,126,8
casualty insurance jobs against hunt up willinghearted into  rpn,0,10,2,1,7.8,87,6
rt   issues severe warnings for parts of   expect more trauma cases ,1,18,3,1,6.5,134,14
does this apply to muslims terrorism  or catholicism homophobia ,0,7,4,0,8.285714285714286,64,4
just saw the man whose mind exploded  there should be a drako zarharzar day ,0,14,6,0,4.5,76,2
drake spokes rep for the raptors beg to differ the other night when shots rang out at musik wasn t a goodlook running in panic no fun,0,24,12,0,4.583333333333333,133,3
i got it for the mistake but boss got it worse cause their job was to oversee my work  boss didn t change after that ,0,25,12,0,4.36,133,7
texas seeks comment on rules for changes to windstormaeinsurer,1,10,3,1,7.6,85,5
elephant population declined by 60  in five years census reveals,0,13,2,2,8.307692307692308,120,12
